,Unnamed: 0,Unnamed: 0.1,Unnamed: 0.1.1,Text,Date,Favorites,Retweets,Tweet ID,sentiment,pos_pct,neg_pct
0,0,0,0,These watchdog groups just accused Donald Trump of breaking campaign finance law https://mic.com/articles/170158/donald-trump-broke-law-campaign-finance-2020-election-clc-common-cause-watchdogs-complaint … via @Mic,2017-03-02 14:37:38,0,0,837431733318361088,"{'neg': 0.136, 'neu': 0.864, 'pos': 0.0, 'compound': -0.296}",0.04552,0.03252
1,1,1,1,Donald Trump has 'total' confidence in Jeff Sessions but 'wasn't aware' of Russia conversations http://fw.to/cEngWzb ,2017-03-02 13:23:19,0,0,837413032284180480,"{'neg': 0.0, 'neu': 0.867, 'pos': 0.133, 'compound': 0.2846}",0.04552,0.03252
2,2,2,2,Doublespeak enables a politician to have it both ways while still brown nosing Steve Bannon & Donald Trump https://twitter.com/LVview/status/837334109630259200 …,2017-03-02 11:49:22,0,0,837389386836660224,"{'neg': 0.0, 'neu': 1.0, 'pos': 0.0, 'compound': 0.0}",0.04552,0.03252
3,3,3,3,"Ah, the poetry! MT @DavidYankovich: Donald Trump is learning why Presidents don't fuck with the Intel community.",2017-03-02 11:03:21,1,0,837377807181201409,"{'neg': 0.0, 'neu': 0.836, 'pos': 0.164, 'compound': 0.484}",0.04552,0.03252
4,4,4,4,Donald Trump and the end of American exceptionalism? http://www.bbc.co.uk/news/world-us-canada-39133677 …,2017-03-02 10:33:22,0,0,837370260156080128,"{'neg': 0.0, 'neu': 1.0, 'pos': 0.0, 'compound': 0.0}",0.04552,0.03252
5,5,5,5,PRESIDENT DONALD TRUMP'S Joint Address to Congress on Feb. 28 drew the following statement Tuesday evening from... http://fb.me/8NWAOY611 ,2017-03-02 08:27:26,0,0,837338569148518401,"{'neg': 0.0, 'neu': 1.0, 'pos': 0.0, 'compound': 0.0}",0.04552,0.03252
6,6,6,6,"PROTECTING MEDICARE, MEDICAID AND SOCIAL SECURITY is the aim of a letter sent to Pres. Donald Trump today from 16... http://fb.me/5kl7hxAvy ",2017-03-02 08:22:51,0,0,837337417552019456,"{'neg': 0.0, 'neu': 0.858, 'pos': 0.142, 'compound': 0.4824}",0.04552,0.03252
7,7,7,7,"IN ADVANCE OF PRES. DONALD TRUMP'S ADDRESS TO CONGRESS, broadcast Tuesday at 4 p.m., Hawai`i time, Ka`u's... http://fb.me/8oZrag4lE ",2017-03-02 08:21:32,0,0,837337085300256768,"{'neg': 0.0, 'neu': 1.0, 'pos': 0.0, 'compound': 0.0}",0.04552,0.03252
8,8,8,8,Jimmy Fallon Brings Back Donald Trump News Network To Report On U.S. Congress Adress - Watch Here! pic.twitter.com/7q74P51z39,2017-03-02 06:16:28,0,0,837305608457994241,"{'neg': 0.0, 'neu': 1.0, 'pos': 0.0, 'compound': 0.0}",0.04552,0.03252
9,9,9,9,Investigate Donald Trump http://petitions.moveon.org/s/F_KSyM  @moveon,2017-03-02 03:17:43,0,0,837260626565218304,"{'neg': 0.0, 'neu': 1.0, 'pos': 0.0, 'compound': 0.0}",0.04552,0.03252
10,10,10,10,"""How Alec Baldwin Gets Into Character as Donald Trump"" by GIOVANNI RUSSONELLO via NYT http://ift.tt/2lgkJDq ",2017-03-02 02:19:52,0,0,837246066881867776,"{'neg': 0.0, 'neu': 1.0, 'pos': 0.0, 'compound': 0.0}",0.04552,0.03252
11,11,11,11,FIX YOUR EYEBROWS DONALD TRUMP LMAODJDNFNF,2017-03-02 00:39:57,0,0,837220922746527744,"{'neg': 0.0, 'neu': 1.0, 'pos': 0.0, 'compound': 0.0}",0.04552,0.03252
12,12,12,12,8.  that Donald Trump will likely unilaterally remove all sanctions against Russia in the coming days or weeks. The Russian government’s oil,2017-03-01 23:54:57,0,0,837209599920881664,"{'neg': 0.0, 'neu': 1.0, 'pos': 0.0, 'compound': 0.0}",0.04552,0.03252
13,13,13,13,Van Jones wasn’t the only one to jump the cable news shark last night over Donald Trump http://hawaiinformer.com/23943/van-jones-wasnt-the-only-one-to-jump-the-cable-news-shark-last-night-over-donald-trump/ …pic.twitter.com/dX49MXNEoP,2017-03-01 23:22:46,0,0,837201497230311425,"{'neg': 0.0, 'neu': 1.0, 'pos': 0.0, 'compound': 0.0}",0.04552,0.03252
14,14,14,14,Almost every big claim Donald Trump just made was false http://www.independent.co.uk/news/world/americas/us-politics/donald-trump-speech-fact-check-lies-claims-joint-address-congress-jobs-immigration-pipeline-a7604861.html …,2017-03-01 23:06:07,0,0,837197309972664324,"{'neg': 0.0, 'neu': 1.0, 'pos': 0.0, 'compound': 0.0}",0.04552,0.03252
15,15,15,15,@Honeyschil @politicususa The bar for Donald Trump is set so low that white Media is celebrating that he can actually read. #MAGA,2017-03-01 22:51:04,1,0,837193519987048448,"{'neg': 0.104, 'neu': 0.756, 'pos': 0.14, 'compound': 0.2403}",0.04552,0.03252
16,16,16,16,Fact Check: Donald Trump touts crime-related executive orders that don't do much. https://www.nytimes.com/interactive/2017/02/28/us/politics/fact-check-trump-congress-address.html …,2017-03-01 22:29:15,0,0,837188031769542656,"{'neg': 0.084, 'neu': 0.916, 'pos': 0.0, 'compound': -0.0258}",0.04552,0.03252
17,17,17,17,Has Donald Trump become the ‘don’t blame me’ president? http://fb.me/8IpEXS7eJ ,2017-03-01 19:48:46,0,0,837147645193789440,"{'neg': 0.0, 'neu': 0.816, 'pos': 0.184, 'compound': 0.2584}",0.04552,0.03252
18,18,18,18,Donald Trump Can't Believe How Easily You Suckers Fell for That http://fb.me/19cvgBFG5 ,2017-03-01 18:47:04,0,0,837132117175754753,"{'neg': 0.348, 'neu': 0.652, 'pos': 0.0, 'compound': -0.6526}",0.04552,0.03252
19,19,19,19,I liked a @YouTube video http://youtu.be/7rfBSKgyQ_g?a  Rand Paul on Donald Trump's Speech | Trump's Address,2017-03-01 18:36:17,0,0,837129402551058432,"{'neg': 0.0, 'neu': 0.797, 'pos': 0.203, 'compound': 0.4215}",0.04552,0.03252
20,20,20,20,Donald Trump made 61 statements in his speech. 51 were false http://fb.me/18pxwOP7n ,2017-03-01 17:50:45,0,0,837117943183921154,"{'neg': 0.0, 'neu': 1.0, 'pos': 0.0, 'compound': 0.0}",0.04552,0.03252
21,21,21,21,Rachel Maddow connects the dots between a billionaire Russian oligarch and a bizarre Donald Trump deal http://fb.me/2QDUTmh9j ,2017-03-01 17:49:41,0,0,837117675616649217,"{'neg': 0.141, 'neu': 0.859, 'pos': 0.0, 'compound': -0.3182}",0.04552,0.03252
22,22,22,22,Chicago Police To Donald Trump: We Asked For Help And You Never Responded http://fb.me/1XY9jTMLY ,2017-03-01 17:27:02,0,0,837111977407205376,"{'neg': 0.0, 'neu': 0.828, 'pos': 0.172, 'compound': 0.4019}",0.04552,0.03252
23,23,23,23,Sign if you did not watch Donald Trump's speech last night http://fb.me/53lBcnatL ,2017-03-01 17:13:02,0,0,837108454347034624,"{'neg': 0.0, 'neu': 1.0, 'pos': 0.0, 'compound': 0.0}",0.04552,0.03252
24,24,24,24,Donald Trump acts as his own anonymous source in meeting with network... http://fb.me/8HhG7oKHN ,2017-03-01 17:04:33,0,0,837106318028611584,"{'neg': 0.0, 'neu': 1.0, 'pos': 0.0, 'compound': 0.0}",0.04552,0.03252
