,Unnamed: 0,Unnamed: 0.1,Text,Date,Favorites,Retweets,Tweet ID,sentiment,pos_pct,neg_pct
0,0,0,"Flashback via Buzzfeed:
Sources: Donald Trump Listened In On Phone Lines At... http://ln.is/cnkiF  by #MMFlint via @c0nvey",2017-03-04 15:53:50,0,0,838175683910254592,"{'neg': 0.0, 'neu': 1.0, 'pos': 0.0, 'compound': 0.0}",0.0706870397207,0.101161874253
1,1,1,President Donald Trump is in Florida at his Mar-a-Lago club for the fourth weekend out of the past five weekends http://bos.gl/NmoiNz4 ,2017-03-04 15:45:02,58,85,838173469149966339,"{'neg': 0.0, 'neu': 1.0, 'pos': 0.0, 'compound': 0.0}",0.0706870397207,0.101161874253
2,2,2,Is Obama’s ‘Wire Tapp’ The End Of Donald Trump? Maybe! A Holy-Shit-Y’all Investigation Into WTF! -  http://ln.is/wonkette.com/613824/w8eJq …,2017-03-04 15:41:23,6,1,838172549980770304,"{'neg': 0.268, 'neu': 0.732, 'pos': 0.0, 'compound': -0.7284}",0.0706870397207,0.101161874253
3,3,3,"Bruce Bartlett, former adviser to Ronald Reagan, compares Donald Trump to Nixon and it's EPIC http://www.dailykos.com/story/2017/3/4/1640099/-Bruce-Bartlett-former-adviser-to-Ronald-Reagan-compares-Donald-Trump-to-Nixon-and-it-s-EPIC …",2017-03-04 15:30:37,0,0,838169841538301956,"{'neg': 0.0, 'neu': 1.0, 'pos': 0.0, 'compound': 0.0}",0.0706870397207,0.101161874253
4,4,4,"@RickCanton ""The pipeline will be built from US steel"" - Donald Trump",2017-03-04 15:21:28,1,0,838167540778078208,"{'neg': 0.0, 'neu': 1.0, 'pos': 0.0, 'compound': 0.0}",0.0706870397207,0.101161874253
5,5,5,"@RickCanton ""I do not have business ties to Russia."" - Donald Trump",2017-03-04 15:21:10,1,0,838167465519611906,"{'neg': 0.0, 'neu': 1.0, 'pos': 0.0, 'compound': 0.0}",0.0706870397207,0.101161874253
6,6,6,"Speaking at @Harvard_Law, scholar Michael Sandel examined the forces that lifted Donald Trump to the presidency http://hvrd.me/Dvfu309hIU8 ",2017-03-04 14:50:09,5,4,838159658133094404,"{'neg': 0.0, 'neu': 1.0, 'pos': 0.0, 'compound': 0.0}",0.0706870397207,0.101161874253
7,7,7,Does Donald Trump cheat at golf? A Washington Post investigation. https://wpo.st/ctAf2 ,2017-03-04 14:48:12,0,0,838159166896230401,"{'neg': 0.25, 'neu': 0.75, 'pos': 0.0, 'compound': -0.4588}",0.0706870397207,0.101161874253
8,8,8,@TheFix Jeff Sessions crosses the line by a nose ahead of Donald Trump who fell backward with a thud after tripping on the media's low bar,2017-03-04 14:45:20,1,1,838158446176452610,"{'neg': 0.084, 'neu': 0.916, 'pos': 0.0, 'compound': -0.2732}",0.0706870397207,0.101161874253
9,9,9,"Another thing: Donald Trump is really bad at his job. He's unable to process info, manage his staff, stay focused. He's just a crappy POTUS.",2017-03-04 14:41:29,17,6,838157477300613121,"{'neg': 0.239, 'neu': 0.678, 'pos': 0.084, 'compound': -0.6997}",0.0706870397207,0.101161874253
10,10,10,Yo if you support Donald Trump and you act like this you're an asshole https://twitter.com/flippineugene/status/838147421334978560 …,2017-03-04 14:37:36,0,0,838156499910291456,"{'neg': 0.0, 'neu': 0.714, 'pos': 0.286, 'compound': 0.6369}",0.0706870397207,0.101161874253
11,11,11,Donald Trump is an impressive student of political weasel wording http://www.motherjones.com/kevin-drum/2017/03/donald-trump-impressive-student-political-weasel-wording … via @motherjones #45 #lies #pathetic,2017-03-04 14:36:40,0,0,838156263804514304,"{'neg': 0.0, 'neu': 0.82, 'pos': 0.18, 'compound': 0.5106}",0.0706870397207,0.101161874253
12,12,12,Donald Trump's administration makes me feel like Ralph Wiggum with a flute in his nose. FFS https://twitter.com/Simpsons_tweets/status/838075534764552193 …,2017-03-04 14:30:40,0,0,838154755973206018,"{'neg': 0.216, 'neu': 0.666, 'pos': 0.119, 'compound': -0.4648}",0.0706870397207,0.101161874253
13,13,13,"Donald Trump may be smart, but mentally he prematurely ejaculates http://nydn.us/2m6vsx3 ",2017-03-04 14:29:36,1,0,838154486673727488,"{'neg': 0.0, 'neu': 0.844, 'pos': 0.156, 'compound': 0.2144}",0.0706870397207,0.101161874253
14,14,14,Tweets like this will come back to haunt me when I run for office. I will have a two word reply: Donald Trump. https://twitter.com/onceuponaross/status/838146504527314944 …,2017-03-04 14:14:09,10,0,838150597337546752,"{'neg': 0.112, 'neu': 0.785, 'pos': 0.103, 'compound': -0.0516}",0.0706870397207,0.101161874253
15,15,15,Shock and awe... Donald Trump goes presidential before our very eyes. http://www.drjeffreylant.com/2/post/2017/03/shock-and-awe-donald-trump-goes-presidential-before-our-very-eyes.html … …,2017-03-04 14:05:03,0,0,838148309638344705,"{'neg': 0.191, 'neu': 0.809, 'pos': 0.0, 'compound': -0.3818}",0.0706870397207,0.101161874253
16,16,16,"@BobbyBigWheel [Donald Trump shoving chess pieces in his mouth]
Another masterful move",2017-03-04 14:00:57,4,0,838147274890948608,"{'neg': 0.0, 'neu': 1.0, 'pos': 0.0, 'compound': 0.0}",0.0706870397207,0.101161874253
17,17,17,"Donald Trump Just Got Humiliated By The DICTIONARY Again, And It’s F*cking EPIC (TWEETS) http://bit.ly/2mnfsJc ",2017-03-04 14:00:30,5,3,838147165499363328,"{'neg': 0.146, 'neu': 0.854, 'pos': 0.0, 'compound': -0.34}",0.0706870397207,0.101161874253
18,18,18,#DrainTheSwamp  WATCH: Donald Trump Releases Short Video and Asks EVERYONE to Watch It http://washingtonstarnews.ga/8U   see here  RT pic.twitter.com/ycdX5ps5Uc,2017-03-04 13:56:05,0,0,838146052083458049,"{'neg': 0.0, 'neu': 1.0, 'pos': 0.0, 'compound': 0.0}",0.0706870397207,0.101161874253
19,19,19,#DonaldTrump: Probably getting #impeached soon so I'm gonna blame it on #Obama for one last #dogwhistle to rile up supporters; #wiretapping,2017-03-04 13:48:59,1,0,838144264513126401,"{'neg': 0.108, 'neu': 0.773, 'pos': 0.118, 'compound': 0.0609}",0.0706870397207,0.101161874253
20,20,20,"Since Donald #Trump's selling point for #KeystoneXL was to create jobs and boast US manufacturing, how is using Chinese steel gonna do that?https://twitter.com/BernPress/status/838066959333920769 …",2017-03-04 13:00:08,0,1,838131970324455425,"{'neg': 0.0, 'neu': 0.913, 'pos': 0.087, 'compound': 0.2732}",0.0706870397207,0.101161874253
21,21,21,This liberal painfully admits where Donald Trump is getting it right http://on.mktw.net/2mNWtp1 ,2017-03-04 13:00:04,0,0,838131953333317636,"{'neg': 0.218, 'neu': 0.641, 'pos': 0.141, 'compound': -0.296}",0.0706870397207,0.101161874253
22,22,22,Vietnam absentee Donald Trump's military look raises eyebrows https://www.theguardian.com/us-news/2017/mar/02/donald-trump-military-look-jacket-cap?CMP=share_btn_tw …,2017-03-04 12:56:40,1,1,838131101038170112,"{'neg': 0.208, 'neu': 0.792, 'pos': 0.0, 'compound': -0.2732}",0.0706870397207,0.101161874253
23,23,23,Timeline: How Russia is haunting Donald Trump https://www.axios.com/timeline-how-russian-contact-doomed-2-trump-aides-2294936423.html …,2017-03-04 12:49:30,664,441,838129296250138630,"{'neg': 0.231, 'neu': 0.769, 'pos': 0.0, 'compound': -0.2732}",0.0706870397207,0.101161874253
24,24,24,"Donald #Trump's FCC proves once again that they only fight for freedom for corporations, not the American people.http://www.commondreams.org/views/2017/03/02/new-fcc-chairman-begins-attacks-internet-privacy …",2017-03-04 12:44:37,1,0,838128068669616131,"{'neg': 0.114, 'neu': 0.702, 'pos': 0.184, 'compound': 0.3818}",0.0706870397207,0.101161874253
25,25,25,"Donald Trump Just Got Humiliated By The DICTIONARY Again, And It’s F*cking EPIC (TWEETS) http://bit.ly/2mngkOa ",2017-03-04 12:38:00,14,10,838126400435589120,"{'neg': 0.146, 'neu': 0.854, 'pos': 0.0, 'compound': -0.34}",0.0706870397207,0.101161874253
26,26,26,PASS THIS TO DONALD TRUMP: Here’s How George Soros is Trying to Take Him Down http://www.teaparty.org/pass-donald-trump-heres-george-soros-trying-take-222125/#.WLsjlMZj_5I.twitter …,2017-03-04 12:29:10,3,1,838124180201693186,"{'neg': 0.0, 'neu': 1.0, 'pos': 0.0, 'compound': 0.0}",0.0706870397207,0.101161874253
27,27,27,PASS THIS TO DONALD TRUMP: Here’s How George Soros is Trying to Take Him Down http://www.teaparty.org/pass-donald-trump-heres-george-soros-trying-take-222125/#.WLsjOPCnrXg.twitter …,2017-03-04 12:27:38,0,1,838123794808070146,"{'neg': 0.0, 'neu': 1.0, 'pos': 0.0, 'compound': 0.0}",0.0706870397207,0.101161874253
28,28,28,Why Fox News just can't quit Donald Trump https://youtu.be/UYMIgnw2FPU  via @YouTube,2017-03-04 12:25:05,0,0,838123149887684608,"{'neg': 0.0, 'neu': 1.0, 'pos': 0.0, 'compound': 0.0}",0.0706870397207,0.101161874253
29,29,29,Investigate Donald Trump http://petitions.moveon.org/s/28GvbX  @moveon,2017-03-04 12:23:04,0,0,838122643043803136,"{'neg': 0.0, 'neu': 1.0, 'pos': 0.0, 'compound': 0.0}",0.0706870397207,0.101161874253
30,30,30,Is Obama’s ‘Wire Tapp’ The End Of Donald Trump? Maybe! A Holy-Shit-Y’all Investigation Into WTF! https://wonkette.com/613824/is-obamas-wire-tapp-the-end-of-donald-trump-maybe-a-holy-shit-yall-investigation-into-wtf … via @Wonkette,2017-03-04 12:22:26,4,1,838122482511011841,"{'neg': 0.242, 'neu': 0.758, 'pos': 0.0, 'compound': -0.7284}",0.0706870397207,0.101161874253
31,31,31,@nub @NellSco Any Democratic candidate should have been a better choice for a liberal than Donald Trump.,2017-03-04 12:18:15,1,0,838121430508269569,"{'neg': 0.0, 'neu': 0.828, 'pos': 0.172, 'compound': 0.4404}",0.0706870397207,0.101161874253
32,32,32,"Donald Trump didn't voluntarily leave White House. He was fired for his treachery, not by mobs, but by police. Sad end to a terrible show. https://twitter.com/realdonaldtrump/status/838016045222854656 …",2017-03-04 12:16:31,0,0,838120996884385792,"{'neg': 0.324, 'neu': 0.643, 'pos': 0.033, 'compound': -0.8892}",0.0706870397207,0.101161874253
33,33,33,Muslim Adviser Quits After 8 Days Of Donald Trump Administration (Exclus... https://youtu.be/B-FaTXbHRgE  via @YouTube,2017-03-04 12:16:16,0,0,838120932023615488,"{'neg': 0.0, 'neu': 1.0, 'pos': 0.0, 'compound': 0.0}",0.0706870397207,0.101161874253
34,34,34,EDWARD SNOWDEN Everything about Donald Trump https://www.youtube.com/watch?v=mmZpMqMxo2Q&feature=share …,2017-03-04 12:15:56,0,0,838120849123209217,"{'neg': 0.0, 'neu': 1.0, 'pos': 0.0, 'compound': 0.0}",0.0706870397207,0.101161874253
35,35,35,“Donald Trump: Terrorist Recruiter?” by @davepellhttps://medium.com/@davepell/donald-trump-terrorist-recruiter-b4a650c4b0f2#.p5x0sexdq …,2017-03-04 12:13:33,0,0,838120250805743616,"{'neg': 0.485, 'neu': 0.515, 'pos': 0.0, 'compound': -0.6908}",0.0706870397207,0.101161874253
36,36,36,RT RT hrkbenowen: RETWEET if you think Donald Trump is doing a fantastic job as President of the United States. … pic.twitter.com/JV46BBWNcH,2017-03-04 12:07:32,0,1,838118734581620737,"{'neg': 0.0, 'neu': 0.738, 'pos': 0.262, 'compound': 0.7506}",0.0706870397207,0.101161874253
37,37,37,Obama ‘Wire Tapped’ His Campaign — President Donald Trump http://stateofthenation2012.com/?p=67500 ,2017-03-04 12:06:24,0,0,838118447674425344,"{'neg': 0.0, 'neu': 1.0, 'pos': 0.0, 'compound': 0.0}",0.0706870397207,0.101161874253
38,38,38,Emilio Rojas - I Hate Donald Trump (Official Music Video) https://www.youtube.com/watch?v=HYjErsngcAY&feature=share …,2017-03-04 11:50:21,0,0,838114408589049857,"{'neg': 0.316, 'neu': 0.684, 'pos': 0.0, 'compound': -0.5719}",0.0706870397207,0.101161874253
39,39,39,A years time to get dirt on Donald Trump and a BILLION DOLLARS & Obama/HRC screwed that up too,2017-03-04 11:46:29,1,2,838113437725114369,"{'neg': 0.286, 'neu': 0.714, 'pos': 0.0, 'compound': -0.6808}",0.0706870397207,0.101161874253
40,40,40,Barack Obama Rap Song Dissing Donald Trump https://www.youtube.com/watch?v=hmVduUaQukw&feature=share …,2017-03-04 11:39:08,0,0,838111586279641088,"{'neg': 0.0, 'neu': 1.0, 'pos': 0.0, 'compound': 0.0}",0.0706870397207,0.101161874253
41,41,41,From the WSJ --> President Donald Trump Accuses Obama of Wiretapping Him but Offers No Evidence http://buff.ly/2lqHh47 ,2017-03-04 11:31:26,3,0,838109647928176642,"{'neg': 0.231, 'neu': 0.769, 'pos': 0.0, 'compound': -0.5423}",0.0706870397207,0.101161874253
42,42,42,"Jorge Ramos: Donald Trump, I Don't Want to Be Your Friend. Speech from #GoldsmithAwards on Thursday via @TIMEhttp://hvrd.me/d3Qa309zfjK ",2017-03-04 11:30:23,2,1,838109384223916032,"{'neg': 0.063, 'neu': 0.772, 'pos': 0.165, 'compound': 0.4548}",0.0706870397207,0.101161874253
43,43,43,The Scary Donald Trump Song https://www.youtube.com/watch?v=1FWc9Fi9SuA&feature=share …,2017-03-04 11:28:49,0,0,838108991716798464,"{'neg': 0.39, 'neu': 0.61, 'pos': 0.0, 'compound': -0.4939}",0.0706870397207,0.101161874253
44,44,44,@GeraldoRivera #obama never thought for a second #DonaldTrump would actually win! Oops! #obamagate,2017-03-04 11:25:20,1,0,838108113689526274,"{'neg': 0.0, 'neu': 0.715, 'pos': 0.285, 'compound': 0.658}",0.0706870397207,0.101161874253
45,45,45,"#Gossip Donald Trump: Arnold Schwarzenegger Didn't Quit, He Was FIRED! http://dlvr.it/NXdghz   via #GlobalBuzzLivepic.twitter.com/GzW5Qe5Th0",2017-03-04 11:22:36,0,0,838107428587634688,"{'neg': 0.278, 'neu': 0.722, 'pos': 0.0, 'compound': -0.6833}",0.0706870397207,0.101161874253
46,46,46,"Top story: Justin Hendrix on Twitter: ""1/ The wiretaps that Donald Trump ""just … https://twitter.com/justinhendrix/status/838010340579426304 …, see more http://tweetedtimes.com/poochiesan24?s=tnp …",2017-03-04 11:10:41,0,0,838104428137889793,"{'neg': 0.0, 'neu': 0.899, 'pos': 0.101, 'compound': 0.2023}",0.0706870397207,0.101161874253
47,47,47,@ValerieJarrett so we're to believe a FISA warrant was issued on Donald Trump during a prez campaign and the Whitehouse had NO IDEA? #really,2017-03-04 11:04:34,5,2,838102887054118912,"{'neg': 0.123, 'neu': 0.877, 'pos': 0.0, 'compound': -0.4466}",0.0706870397207,0.101161874253
48,48,48,@ctnash91 Donald Trump tweets,2017-03-04 11:03:14,1,0,838102553082609665,"{'neg': 0.0, 'neu': 1.0, 'pos': 0.0, 'compound': 0.0}",0.0706870397207,0.101161874253
49,49,49,"""The diversionary reverse accusation."" What to Make of Donald Trump’s Early-Morning Wiretap Tweets http://www.newyorker.com/news/news-desk/donald-trumps-early-morning-tweets … via @newyorker",2017-03-04 10:59:30,0,0,838101612317065216,"{'neg': 0.0, 'neu': 1.0, 'pos': 0.0, 'compound': 0.0}",0.0706870397207,0.101161874253
50,50,50,"Coming up at 2:00 PM on @wbznewsradio, an Obama spokesman says the White House never ordered a wiretap on Donald Trump or any U.S. citizen.",2017-03-04 10:57:27,0,0,838101098653171712,"{'neg': 0.0, 'neu': 1.0, 'pos': 0.0, 'compound': 0.0}",0.0706870397207,0.101161874253
51,51,51,A Man Unhinged :Donald Trump says President OBama wire tapped him. This Mad Tweeter Tweeted at 6am his latest Salvo after attacking Arnold S,2017-03-04 10:46:42,1,0,838098390630170624,"{'neg': 0.237, 'neu': 0.763, 'pos': 0.0, 'compound': -0.7351}",0.0706870397207,0.101161874253
52,52,52,@Rosiehttps://twitter.com/georgetakei/status/838054524656861184 …,2017-03-04 10:34:22,0,0,838095288711667713,"{'neg': 0.0, 'neu': 1.0, 'pos': 0.0, 'compound': 0.0}",0.0706870397207,0.101161874253
53,53,53,SCANDAL OF THE CENTURY! Donald Trump Just Exposed Obama For HORRIBLE Crime! HERE IS THE PROOF!! http://theatlantic.ga/5at  #TrumpTrainpic.twitter.com/q8ZrbSVi3G,2017-03-04 10:33:09,0,0,838094982523183104,"{'neg': 0.497, 'neu': 0.503, 'pos': 0.0, 'compound': -0.9304}",0.0706870397207,0.101161874253
54,54,54,"Donald Trump isn't voluntarily leaving the presidency, he was impeached by his bad (treasonous) dealings. Sad end to a most prestigious job. https://twitter.com/realDonaldTrump/status/838016045222854656 …",2017-03-04 10:30:48,9,1,838094392661577728,"{'neg': 0.248, 'neu': 0.752, 'pos': 0.0, 'compound': -0.765}",0.0706870397207,0.101161874253
55,55,55,@amandablount2 @VanJones68 his job is to expose him for the corrupt pos he is not coddle him or normalize his behavior!,2017-03-04 10:29:27,0,0,838094051366809600,"{'neg': 0.086, 'neu': 0.914, 'pos': 0.0, 'compound': -0.2244}",0.0706870397207,0.101161874253
56,56,56,@therealroseanne DT doesn't pay taxes cuz he's smart. U r a hypocrite. He's a pedo!,2017-03-04 10:28:33,0,0,838093826220785664,"{'neg': 0.0, 'neu': 0.677, 'pos': 0.323, 'compound': 0.5086}",0.0706870397207,0.101161874253
57,57,57,"@realDonaldTrump from all of us who voted for @HillaryClinton We are the champions, no time for losers! @Rosiehttps://youtu.be/3B_W_CZfVtc ",2017-03-04 10:26:04,0,0,838093200048984069,"{'neg': 0.243, 'neu': 0.617, 'pos': 0.14, 'compound': -0.3595}",0.0706870397207,0.101161874253
58,58,58,"#Breaking_News Donald Trump: Arnold Schwarzenegger Didn't Quit, He Was FIRED! http://dlvr.it/NXckFT  via #Indilenspic.twitter.com/ElewlfBFKK",2017-03-04 10:20:00,0,0,838091673737404416,"{'neg': 0.278, 'neu': 0.722, 'pos': 0.0, 'compound': -0.6833}",0.0706870397207,0.101161874253
59,59,59,Le destin de plusieurs milliers d’Haïtiens suspendu à la plume de Donald Trump http://fb.me/54lrenOXZ ,2017-03-04 10:19:08,0,0,838091452966109185,"{'neg': 0.0, 'neu': 1.0, 'pos': 0.0, 'compound': 0.0}",0.0706870397207,0.101161874253
60,60,60,Donald Trump's staff keeps trying to get him to try this new phone... pic.twitter.com/2MQVJX22Yi,2017-03-04 10:16:01,4,3,838090672108417028,"{'neg': 0.0, 'neu': 1.0, 'pos': 0.0, 'compound': 0.0}",0.0706870397207,0.101161874253
61,61,61,OMG!! Donald Trump was a conspiracy-theory candidate. Now he’s a conspiracy-theory president.,2017-03-04 10:09:49,2,2,838089111386882048,"{'neg': 0.0, 'neu': 1.0, 'pos': 0.0, 'compound': 0.0}",0.0706870397207,0.101161874253
62,62,62,"Donald Trump has the temperament to be president, said no one ever.",2017-03-04 10:09:32,1,1,838089037281914880,"{'neg': 0.167, 'neu': 0.833, 'pos': 0.0, 'compound': -0.296}",0.0706870397207,0.101161874253
63,63,63,"Everyone has an opinion about Donald Trump, including ISIS recruits http://s.pri.org/ZBlkZmw ",2017-03-04 10:05:12,0,1,838087949585625088,"{'neg': 0.0, 'neu': 1.0, 'pos': 0.0, 'compound': 0.0}",0.0706870397207,0.101161874253
64,64,64,"@tremr_app The law says that I can call any public figure, including any President, any name I want.

I call Donald Trump ""The Dirtbag"".",2017-03-04 10:03:21,0,0,838087482889625600,"{'neg': 0.0, 'neu': 0.939, 'pos': 0.061, 'compound': 0.0772}",0.0706870397207,0.101161874253
65,65,65,@realDonaldTrump you would know all about Lows! U have the lowest IQ of every prez before u. U have the lowest approval ratings since Nixon!,2017-03-04 09:58:42,0,0,838086314419449856,"{'neg': 0.255, 'neu': 0.64, 'pos': 0.104, 'compound': -0.5399}",0.0706870397207,0.101161874253
66,66,66,Donald Trump is proof you shouldn't tell your kids that they can be whatever they want to be when they grow up.,2017-03-04 09:36:25,5,3,838080706383331330,"{'neg': 0.0, 'neu': 0.942, 'pos': 0.058, 'compound': 0.0772}",0.0706870397207,0.101161874253
67,67,67,#IncomeInequality #WealthInequality The Real Beneficiaries of Donald Trump's Fake Populism http://feeds.feedblitz.com/~/277248836/0/alternet …pic.twitter.com/pSNkfpDrxo,2017-03-04 09:29:10,0,0,838078878409240577,"{'neg': 0.208, 'neu': 0.604, 'pos': 0.188, 'compound': -0.0772}",0.0706870397207,0.101161874253
68,68,68,"ahhaha i didn't see this until now, Trump twitter actually says Real Donald Trump lol he doesn't even know if he is real yet.",2017-03-04 09:27:08,0,0,838078367605919745,"{'neg': 0.0, 'neu': 0.887, 'pos': 0.113, 'compound': 0.4215}",0.0706870397207,0.101161874253
69,69,69,Donald Trump and the new dawn of tyranny http://ti.me/2m3NaS4 ,2017-03-04 09:16:29,2,0,838075689387585536,"{'neg': 0.0, 'neu': 1.0, 'pos': 0.0, 'compound': 0.0}",0.0706870397207,0.101161874253
70,70,70,Donald Trump is basically Brick Tamland. He thinks #loudvoices are contributions to political discourse.https://twitter.com/davidkoechner/status/838073568378286080 …,2017-03-04 09:12:32,2,0,838074694490259457,"{'neg': 0.0, 'neu': 1.0, 'pos': 0.0, 'compound': 0.0}",0.0706870397207,0.101161874253
71,71,71,Donald Trump took one last shot at Arnold Schwarzenegger over quitting The Apprentice because of course he did lmao http://on.mash.to/2m5RAb5 ,2017-03-04 09:09:26,0,0,838073916056866816,"{'neg': 0.0, 'neu': 0.83, 'pos': 0.17, 'compound': 0.5994}",0.0706870397207,0.101161874253
72,72,72,If Al Capone the tax dodging scamming thug had been real white he'd have been the #AmericanPresident like #DonaldTrump #justiceforAlCapone ,2017-03-04 08:53:39,1,0,838069942721384448,"{'neg': 0.064, 'neu': 0.822, 'pos': 0.114, 'compound': 0.2732}",0.0706870397207,0.101161874253
73,73,73,Donald Trump swipes at Dems over Russian face time http://bhne.ws/YsTSWBC pic.twitter.com/q3GO97Xsxu,2017-03-04 08:48:05,2,1,838068542796926983,"{'neg': 0.0, 'neu': 1.0, 'pos': 0.0, 'compound': 0.0}",0.0706870397207,0.101161874253
74,74,74,A lot of fun sound bites coming from Mark Cuban. This man.... is not a fan of Donald Trump....,2017-03-04 08:45:54,1,0,838067993653436421,"{'neg': 0.097, 'neu': 0.74, 'pos': 0.163, 'compound': 0.3265}",0.0706870397207,0.101161874253
75,75,75,".@Scott_Wiener

Donald #Trump just hates America. Who needs #ISIS when we have a president like him?https://twitter.com/Scott_Wiener/status/838060962271768576 …",2017-03-04 08:42:52,2,0,838067228859850753,"{'neg': 0.158, 'neu': 0.707, 'pos': 0.136, 'compound': -0.1027}",0.0706870397207,0.101161874253
76,76,76,An Unhinged Donald Trump Accuses Democrats of a 'Total Witch Hunt!' #TheResistance #StopTrump #TrumpRussia http://crwd.fr/2mnkEx2 pic.twitter.com/rYIsDOuLF7,2017-03-04 08:42:51,0,0,838067222794878976,"{'neg': 0.302, 'neu': 0.698, 'pos': 0.0, 'compound': -0.636}",0.0706870397207,0.101161874253
77,77,77,Donald Trump's profitable presidency http://theweek.com/articles/683357/donald-trumps-profitable-presidency?utm_campaign=newsletter&utm_source=afternoon&utm_medium=03_04_17-article_1-683357 …,2017-03-04 08:41:39,0,0,838066922927321088,"{'neg': 0.0, 'neu': 0.58, 'pos': 0.42, 'compound': 0.4404}",0.0706870397207,0.101161874253
78,78,78,@theta1138 And also remember that one intelligence reporter was told by a contact that Donald Trump will die in jail.,2017-03-04 08:33:27,0,0,838064857408753666,"{'neg': 0.163, 'neu': 0.708, 'pos': 0.129, 'compound': -0.2023}",0.0706870397207,0.101161874253
79,79,79,"Timeline: How Russia is haunting Donald Trump, Great read!! #TrumpRussia #ImpeachTrump #StopTrump #Resist http://crwd.fr/2m89ueL pic.twitter.com/bxh20rAMYk",2017-03-04 08:32:55,0,0,838064723987935232,"{'neg': 0.112, 'neu': 0.639, 'pos': 0.249, 'compound': 0.555}",0.0706870397207,0.101161874253
80,80,80,"""Donald Trump, Republicans, Russians (sorry for repeating myself) are trying to freeze us out. We won't be frozen out"" #IStandWithPP #boston",2017-03-04 08:28:00,0,0,838063489050628096,"{'neg': 0.0, 'neu': 0.943, 'pos': 0.057, 'compound': 0.0516}",0.0706870397207,0.101161874253
81,81,81,Does Donald Trump Plan To Admit 2.5 Million Immigrants A Year? (Hint: Kind Of Like Canada) http://dlvr.it/NXZyb8 pic.twitter.com/emtdpcblNN,2017-03-04 08:26:11,0,0,838063031741394944,"{'neg': 0.0, 'neu': 0.765, 'pos': 0.235, 'compound': 0.5106}",0.0706870397207,0.101161874253
82,82,82,Andrew Jackson's legacy on Native Americans is something Donald Trump shouldn't emulate http://bit.ly/2ldvHt7 ,2017-03-04 08:19:37,4,3,838061376904048640,"{'neg': 0.0, 'neu': 1.0, 'pos': 0.0, 'compound': 0.0}",0.0706870397207,0.101161874253
83,83,83,"These ebbs and flows, ups and downs, are just who President Donald Trump is. There are no two Trumps. http://wbur.fm/2mDv3p6 ",2017-03-04 08:00:02,4,0,838056450349944832,"{'neg': 0.104, 'neu': 0.896, 'pos': 0.0, 'compound': -0.296}",0.0706870397207,0.101161874253
84,84,84,"Donald Trump's now accusing 'sick' Obama of wiretapping him, and he can prove it! Because [INSERT PROOF HERE] http://on.mash.to/2m5WLHP ",2017-03-04 07:59:29,0,0,838056311451430912,"{'neg': 0.1, 'neu': 0.9, 'pos': 0.0, 'compound': -0.2481}",0.0706870397207,0.101161874253
85,85,85,"Laugh-of-the-week, Oval Office Paranoia: @DonaldTrump accuses Obama of 'wire-tapping' his office before election https://www.theguardian.com/us-news/2017/mar/04/donald-trump-accuses-obama-of-wire-tapping-his-office-before-election?CMP=share_btn_tw …",2017-03-04 07:57:01,0,0,838055692099538944,"{'neg': 0.268, 'neu': 0.732, 'pos': 0.0, 'compound': -0.5267}",0.0706870397207,0.101161874253
86,86,86,Donald Trump Questions ‘Sick Guy’ Barack Obama for ‘Wire Tapping’ His Campaign - Breitbart http://www.breitbart.com/big-government/2017/03/04/donald-trump-questions-sick-guy-barack-obama-wire-tapping-campaign/ … via @BreitbartNews,2017-03-04 07:48:00,0,0,838053419055210496,"{'neg': 0.18, 'neu': 0.82, 'pos': 0.0, 'compound': -0.5106}",0.0706870397207,0.101161874253
87,87,87,Big Survey Shows Firm Majority Support for Donald Trump's Refugee Reform - Breitbart http://www.breitbart.com/big-government/2017/03/03/survey-solid-majority-trump-refugee-reform/ … via @BreitbartNews,2017-03-04 07:44:45,0,0,838052603359539202,"{'neg': 0.0, 'neu': 0.838, 'pos': 0.162, 'compound': 0.4019}",0.0706870397207,0.101161874253
88,88,88,Big Survey Shows Firm Majority Support for Donald Trump's Refugee Reform - Breitbart http://www.breitbart.com/big-government/2017/03/03/survey-solid-majority-trump-refugee-reform/ …,2017-03-04 07:44:30,0,0,838052539568357377,"{'neg': 0.0, 'neu': 0.816, 'pos': 0.184, 'compound': 0.4019}",0.0706870397207,0.101161874253
89,89,89,Donald Trump accuses Barack Obama of wire tapping his phones http://dailym.ai/2lK1ttZ  via @MailOnline,2017-03-04 07:33:06,0,0,838049670744043526,"{'neg': 0.167, 'neu': 0.833, 'pos': 0.0, 'compound': -0.34}",0.0706870397207,0.101161874253
90,90,90,"#donaldtrump  More interested in The Apprentice than healthcare,polution & Russian involvement in our Democracy, etc.",2017-03-04 07:31:04,0,0,838049160511258624,"{'neg': 0.0, 'neu': 0.813, 'pos': 0.187, 'compound': 0.4576}",0.0706870397207,0.101161874253
