,Unnamed: 0,Text,Date,Favorites,Retweets,Tweet ID,sentiment,pos_pct,neg_pct
0,0,Obama EPA Head Savages Donald Trump’s Environmental Policies https://www.google.com/amp/m.huffpost.com/us/entry/us_58bb08cee4b0d2821b4e977e/amp …,2017-03-04 15:56:24,16,20,838176332500598784,"{'neg': 0.298, 'neu': 0.702, 'pos': 0.0, 'compound': -0.5267}",0.0534818181818,0.128545454545
1,1,BREAKING: Donald Trump Releases His Dirt on Obama. It’s BIG and About Time! TRUTH WINS. http://www.teaparty.org/breaking-donald-trump-releases-dirt-obama-big-time-truth-wins-222032/#.WLtTw26DdR4.twitter …,2017-03-04 15:55:16,0,0,838176045740212225,"{'neg': 0.104, 'neu': 0.561, 'pos': 0.335, 'compound': 0.7475}",0.0534818181818,0.128545454545
2,2,@Eh_Palm @stillgray Donald Trump is your president.,2017-03-04 15:55:03,0,0,838175992543784960,"{'neg': 0.0, 'neu': 1.0, 'pos': 0.0, 'compound': 0.0}",0.0534818181818,0.128545454545
3,3,The Intelligence Community/ of Obama-made a request to a FISA court for the NSA to spy on Donald Trump :https://www.facebook.com/gary.homberg/posts/1415390798502305 …,2017-03-04 15:52:43,0,0,838175402405298177,"{'neg': 0.0, 'neu': 0.846, 'pos': 0.154, 'compound': 0.4767}",0.0534818181818,0.128545454545
4,4,"'“I’m going to try to help our president, Donald Trump, be as successful as possible because, number one, I agree... http://fb.me/1PZMsIm9m ",2017-03-04 15:49:06,0,0,838174492635586561,"{'neg': 0.0, 'neu': 0.685, 'pos': 0.315, 'compound': 0.7783}",0.0534818181818,0.128545454545
5,5,"NEWS OVER WIRE JUST IN---- PRESIDENT DONALD TRUMP HAS REACHED A HUGE NUMBER, 26 MILLION TWITTER PEOPLE FOLLOW & LOVE HIM.~ HE IS FOR US~",2017-03-04 15:39:59,2,1,838172200079282176,"{'neg': 0.0, 'neu': 0.61, 'pos': 0.39, 'compound': 0.9028}",0.0534818181818,0.128545454545
6,6,"It is Saturday, March 4 ,2017 and Donald Trump is still president",2017-03-04 15:39:07,0,0,838171981765873666,"{'neg': 0.0, 'neu': 1.0, 'pos': 0.0, 'compound': 0.0}",0.0534818181818,0.128545454545
7,7,@SarahPalinUSA Donald #Trump is king of deflection and red herrings when under pressure. However everyone recognizes his antics #Ineffective,2017-03-04 15:31:48,0,0,838170142035050496,"{'neg': 0.109, 'neu': 0.891, 'pos': 0.0, 'compound': -0.296}",0.0534818181818,0.128545454545
8,8,What would actually happen if Donald Trump was impeached? http://www.independent.co.uk/news/world/americas/us-elections/donald-trump-impeached-what-would-happen-president-sexual-assault-fraud-university-a7409736.html …,2017-03-04 15:25:23,0,0,838168526699573248,"{'neg': 0.0, 'neu': 1.0, 'pos': 0.0, 'compound': 0.0}",0.0534818181818,0.128545454545
9,9,Twelve hours of silence. Donald Trump has put the White House in the awkward position of needing to admit that Breitbart is real fake news.,2017-03-04 15:12:11,105,35,838165204756271104,"{'neg': 0.165, 'neu': 0.772, 'pos': 0.063, 'compound': -0.4404}",0.0534818181818,0.128545454545
10,10,Donald Trump Questions ‘Sick Guy’ Barack Obama for ‘Wire Tapping’ His Campaign - Breitbart http://bit.ly/2lJORD8  #Maga #trump,2017-03-04 15:10:28,10,10,838164773384552448,"{'neg': 0.18, 'neu': 0.82, 'pos': 0.0, 'compound': -0.5106}",0.0534818181818,0.128545454545
11,11,@VicenteFoxQue @realDonaldTrump And the people want Donald Trump. And we are building the wall and you cant do anything about it.,2017-03-04 15:02:33,0,0,838162779982934016,"{'neg': 0.0, 'neu': 0.939, 'pos': 0.061, 'compound': 0.0772}",0.0534818181818,0.128545454545
12,12,"Donald Trump Jr's posts adorable family photo
http://dailym.ai/2lKE0c0  via @MailOnline",2017-03-04 14:59:46,0,0,838162077319577602,"{'neg': 0.0, 'neu': 0.738, 'pos': 0.262, 'compound': 0.4939}",0.0534818181818,0.128545454545
13,13,"Donald Trump accuses Barack Obama of wire tapping his phones. https://tiny.iavian.net/fkz2 
#Trump45 #ShadowGovernment #FoxNews #MAGA",2017-03-04 14:50:49,0,0,838159825234194432,"{'neg': 0.146, 'neu': 0.854, 'pos': 0.0, 'compound': -0.34}",0.0534818181818,0.128545454545
14,14,"Donald Trump may be smart, but mentally he prematurely ejaculates - NY Daily News http://www.nydailynews.com/opinion/donald-trump-smart-mentally-prematurely-ejaculates-article-1.2988840 …",2017-03-04 14:49:44,0,0,838159552721858560,"{'neg': 0.0, 'neu': 0.875, 'pos': 0.125, 'compound': 0.2144}",0.0534818181818,0.128545454545
15,15,"The Election of Donald Trump – A Fulfillment of Prophecy? 

Every nation answering to one single global governing... http://fb.me/2VwwMpNFW ",2017-03-04 14:39:51,0,0,838157065168236546,"{'neg': 0.0, 'neu': 1.0, 'pos': 0.0, 'compound': 0.0}",0.0534818181818,0.128545454545
16,16,"Donald Trump may be smart, but mentally he prematurely ejaculates - NY Daily News https://www.google.com/amp/www.nydailynews.com/amp/opinion/donald-trump-smart-mentally-prematurely-ejaculates-article-1.2988840 …",2017-03-04 14:39:43,58,32,838157032150740992,"{'neg': 0.0, 'neu': 0.875, 'pos': 0.125, 'compound': 0.2144}",0.0534818181818,0.128545454545
17,17,"3 de marzo de 2017
Crisis de Trump en Rusia: una línea de tiempo
El presidente Donald Trump ha sido perseguido... http://fb.me/3iqWxa2b9 ",2017-03-04 14:33:08,0,0,838155375996198912,"{'neg': 0.161, 'neu': 0.745, 'pos': 0.094, 'compound': -0.4019}",0.0534818181818,0.128545454545
18,18,"March 3, 2017
Trump’s Russia Crisis: A Timeline 
President Donald Trump has been dogged by controversy over... http://fb.me/5O4BAlPuJ ",2017-03-04 14:32:07,0,0,838155121297084416,"{'neg': 0.204, 'neu': 0.796, 'pos': 0.0, 'compound': -0.6249}",0.0534818181818,0.128545454545
19,19,"Donald Trump panics over Russia: Jeff Sessions, Priebus, Bannon all huddled at Mar-a-Lago http://www.palmerreport.com/opinion/donald-trump-russia-panic-time-jeff-sessions-priebus-bannon-huddled-mar-lago/1780/ … via @PalmerReport",2017-03-04 14:31:40,0,0,838155005022638080,"{'neg': 0.162, 'neu': 0.838, 'pos': 0.0, 'compound': -0.4404}",0.0534818181818,0.128545454545
20,20,BREAKING: Donald Trump Makes Move to TAKE NANCY PELOSI DOWN. Do You Support It? http://MAGA.TrumpNewss.com/4Zz pic.twitter.com/FSC3BQEkCd,2017-03-04 14:20:05,13,3,838152091616976898,"{'neg': 0.0, 'neu': 0.838, 'pos': 0.162, 'compound': 0.4019}",0.0534818181818,0.128545454545
21,21,Donald Trump Questions ‘Sick Guy’ Barack Obama for ‘Wire Tapping’ His Campaign - Breitbart http://bit.ly/2lJORD8  TRUMP IS THE ONE SICK..,2017-03-04 14:19:34,0,0,838151961228754945,"{'neg': 0.155, 'neu': 0.845, 'pos': 0.0, 'compound': -0.5106}",0.0534818181818,0.128545454545
22,22,  WATCH: Donald Trump Releases Short Video and Asks EVERYONE to Watch It http://theguardiannews.ml/DwM  #MakeAmericaGreatAgainpic.twitter.com/JQ4CJTHVqc,2017-03-04 14:16:41,1,1,838151236796874752,"{'neg': 0.0, 'neu': 1.0, 'pos': 0.0, 'compound': 0.0}",0.0534818181818,0.128545454545
23,23,DONALD TRUMP: Obama Wiretapped Trump Tower!!! https://www.youtube.com/watch?v=FD1jHDdG-xQ&feature=share …,2017-03-04 14:16:12,0,0,838151116336562176,"{'neg': 0.0, 'neu': 1.0, 'pos': 0.0, 'compound': 0.0}",0.0534818181818,0.128545454545
24,24,Donald Trump brands Democrats ‘hypocrites’ over Russian links - http://www.telegraph.co.uk/news/2017/03/03/donald-trump-brands-democrats-hypocrites-russian-links/ …,2017-03-04 14:11:07,0,0,838149834993463297,"{'neg': 0.0, 'neu': 1.0, 'pos': 0.0, 'compound': 0.0}",0.0534818181818,0.128545454545
25,25,"Where are your sources, Donald Trump? You condemned the ""fake"" media for refusing to identify sources. Americans don't believe you anymore. https://twitter.com/nytimes/status/838082384163635200 …",2017-03-04 14:10:03,0,0,838149566188879872,"{'neg': 0.219, 'neu': 0.781, 'pos': 0.0, 'compound': -0.6808}",0.0534818181818,0.128545454545
26,26,# Bombshell Towergate: Donald Trump accuses 'sick' Barack Obama of 'Nixon/Watergate' scandal for (cont) http://tl.gd/nnhe03 ,2017-03-04 14:10:02,0,0,838149560908328960,"{'neg': 0.306, 'neu': 0.694, 'pos': 0.0, 'compound': -0.6486}",0.0534818181818,0.128545454545
27,27,I added a video to a @YouTube playlist http://youtu.be/2fcNxc4hZMI?a  AM JOY Donald Trump 3/4/17 Implications For WH For Asking To Deter,2017-03-04 13:58:41,0,0,838146706915086337,"{'neg': 0.0, 'neu': 0.789, 'pos': 0.211, 'compound': 0.6739}",0.0534818181818,0.128545454545
28,28,How Obama Got Around Law to Wiretap Donald Trump http://www.topix.com/forum/city/chico-ca/THGGU835A88UOG6QN … via @topix,2017-03-04 13:57:12,0,0,838146332112138241,"{'neg': 0.0, 'neu': 1.0, 'pos': 0.0, 'compound': 0.0}",0.0534818181818,0.128545454545
29,29,@realDonaldTrump dear Donald trump get over yourself ,2017-03-04 13:54:10,1,0,838145570548109312,"{'neg': 0.0, 'neu': 0.698, 'pos': 0.302, 'compound': 0.3818}",0.0534818181818,0.128545454545
30,30,Will This Man Take Down Donald Trump? http://politi.co/2k6pFIw  RT @politico @freedlander #Trump #Trumprussia #trumptower #wiretapping #news,2017-03-04 13:53:05,0,0,838145296467132416,"{'neg': 0.0, 'neu': 1.0, 'pos': 0.0, 'compound': 0.0}",0.0534818181818,0.128545454545
31,31,Donald Trump's conflicts of interest: a crib sheet https://www.theatlantic.com/business/archive/2017/03/donald-trump-conflicts-of-interests/508382/?google_editors_picks=true&utm_source=twb …,2017-03-04 13:50:36,0,0,838144670475632640,"{'neg': 0.224, 'neu': 0.517, 'pos': 0.259, 'compound': 0.1027}",0.0534818181818,0.128545454545
32,32,"If Trump Tower was bugged, it was bugged by Trump's Russian ""friends.""  Donald Trump is failing miserably AGAIN.  #wiretap #Trump",2017-03-04 13:39:00,1,1,838141752255078401,"{'neg': 0.262, 'neu': 0.738, 'pos': 0.0, 'compound': -0.7506}",0.0534818181818,0.128545454545
33,33,Donald Trump Accuses Obama Of Wiretapping; Obama Responds “Unequivocally False” – Update https://www.yahoo.com/news/donald-trump-accuses-obama-wiretapping-143318699.html?.tsrc=fauxdal … SHAME ON YOU DONALD. BOY GO,2017-03-04 13:35:52,0,0,838140964808065025,"{'neg': 0.28, 'neu': 0.72, 'pos': 0.0, 'compound': -0.7378}",0.0534818181818,0.128545454545
34,34,"EEW!, Maybe even cameras! Sources: Donald Trump Listened In On Phone Lines At Mar-A-Lago https://www.buzzfeed.com/aramroston/sources-donald-trump-listened-in-on-phone-lines-at-mar-a-lag?utm_term=.iiZ2kGwLZ … via @aramroston",2017-03-04 13:28:56,0,0,838139218333478913,"{'neg': 0.0, 'neu': 1.0, 'pos': 0.0, 'compound': 0.0}",0.0534818181818,0.128545454545
35,35,Sources: Donald Trump Listened In On Phone Lines At Mar-A-Lago https://www.buzzfeed.com/aramroston/sources-donald-trump-listened-in-on-phone-lines-at-mar-a-lag?utm_term=.suP0bwgxw … via @aramroston,2017-03-04 13:25:09,0,0,838138265660092417,"{'neg': 0.0, 'neu': 1.0, 'pos': 0.0, 'compound': 0.0}",0.0534818181818,0.128545454545
36,36,Please take Donald Trump with you.  #FirstWordsToAliens,2017-03-04 13:20:18,0,0,838137047126802432,"{'neg': 0.0, 'neu': 0.723, 'pos': 0.277, 'compound': 0.3182}",0.0534818181818,0.128545454545
37,37, SCANDAL OF THE CENTURY! Donald Trump Just Exposed Obama For HORRIBLE Crime! HERE IS THE PROOF!! http://Conservative.trumpnewss.com/9 pic.twitter.com/rzZo4hNO1p,2017-03-04 13:19:52,4,3,838136937785458688,"{'neg': 0.516, 'neu': 0.484, 'pos': 0.0, 'compound': -0.9304}",0.0534818181818,0.128545454545
38,38, SCANDAL OF THE CENTURY! Donald Trump Just Exposed Obama For HORRIBLE Crime! HERE IS THE PROOF!! http://Conservative.trumpnewss.com/9 pic.twitter.com/SSR1CfpVy0,2017-03-04 13:18:31,0,2,838136597493264384,"{'neg': 0.516, 'neu': 0.484, 'pos': 0.0, 'compound': -0.9304}",0.0534818181818,0.128545454545
39,39,Donald Trump Claims Arnold Schwarzenegger ‘Was Fired’ From ‘Celebrity Apprentice’ http://a.msn.com/0A/en-us/AAnMQ23?ocid=st …,2017-03-04 13:18:10,0,0,838136510469701632,"{'neg': 0.265, 'neu': 0.735, 'pos': 0.0, 'compound': -0.5574}",0.0534818181818,0.128545454545
40,40,SCANDAL OF THE CENTURY! Donald Trump Just Exposed Obama for HORRIBLE Crime! HERE IS THE PROOF!! https://libertywritersnews.com/?p=23861  via @liberty_writers,2017-03-04 13:16:35,0,0,838136112405164032,"{'neg': 0.48, 'neu': 0.52, 'pos': 0.0, 'compound': -0.9304}",0.0534818181818,0.128545454545
41,41,I'm following the real Donald trump,2017-03-04 13:09:42,1,0,838134378333110272,"{'neg': 0.0, 'neu': 1.0, 'pos': 0.0, 'compound': 0.0}",0.0534818181818,0.128545454545
42,42,Anyone else sick to death of Donald Trump?,2017-03-04 13:00:20,0,0,838132021545353217,"{'neg': 0.545, 'neu': 0.455, 'pos': 0.0, 'compound': -0.802}",0.0534818181818,0.128545454545
43,43,@NewYorkBoz Obama would not have to hack Donald Trump's Twitter account to make him look stupid...,2017-03-04 12:50:44,0,0,838129607878586368,"{'neg': 0.0, 'neu': 1.0, 'pos': 0.0, 'compound': 0.0}",0.0534818181818,0.128545454545
44,44,BREAKING: Donald Trump Makes Move to TAKE NANCY PELOSI DOWN. Do You Support It? http://NewsUnitedStates.co.vu/1iZ pic.twitter.com/mMwV0dMNHn,2017-03-04 12:50:17,13,10,838129493487190016,"{'neg': 0.0, 'neu': 0.838, 'pos': 0.162, 'compound': 0.4019}",0.0534818181818,0.128545454545
45,45,BREAKING: Donald Trump Makes Move to TAKE NANCY PELOSI DOWN. Do You Support It? http://NewsUnitedStates.co.vu/1iZ pic.twitter.com/nW5zKeltdQ,2017-03-04 12:50:09,8,9,838129459689472001,"{'neg': 0.0, 'neu': 0.838, 'pos': 0.162, 'compound': 0.4019}",0.0534818181818,0.128545454545
46,46,Donald Trump Claims Barack Obama Ordered Wire Tap On Trump Tower Before Election http://www.huffingtonpost.com/entry/donald-trump-twitter-barack-obama-tapped_us_58baadf7e4b0b9989417e736 …,2017-03-04 12:48:44,1,0,838129102922125314,"{'neg': 0.0, 'neu': 1.0, 'pos': 0.0, 'compound': 0.0}",0.0534818181818,0.128545454545
47,47,"@mattyglesias @chrislhayes Do you think maybe Mark Burnette knows ""Donald Trump is a Ratings Machine"" is coming home soon?",2017-03-04 12:40:33,0,1,838127043137134593,"{'neg': 0.0, 'neu': 1.0, 'pos': 0.0, 'compound': 0.0}",0.0534818181818,0.128545454545
48,48,BREAKING: Donald Trump Makes Move to TAKE NANCY PELOSI DOWN. Do You Support It? http://theguardiannews.ml/DvG   see here  RT pic.twitter.com/8z8uI5JSxP,2017-03-04 12:36:16,13,4,838125967054782464,"{'neg': 0.0, 'neu': 0.87, 'pos': 0.13, 'compound': 0.4019}",0.0534818181818,0.128545454545
49,49,#MAGA #TRUMPTRAIN #TRUMP #DONALDTRUMP #GOP #USA #DEPLORABLE #AMERICAFIRSTpic.twitter.com/quD0C8kXCh,2017-03-04 12:33:15,0,0,838125204744335361,"{'neg': 0.0, 'neu': 1.0, 'pos': 0.0, 'compound': 0.0}",0.0534818181818,0.128545454545
50,50,Donald Trump Questions ‘Sick Guy’ Barack Obama for ‘Wire Tapping’ His Campaign - Breitbart http://ln.is/www.breitbart.com/bi/cED0z … via @BreitbartNews,2017-03-04 12:24:15,0,0,838122943616016385,"{'neg': 0.18, 'neu': 0.82, 'pos': 0.0, 'compound': -0.5106}",0.0534818181818,0.128545454545
51,51,"Barack Obama, a so-call former president, is in over his head. He's playing hardball with our Real President. Donald Trump. Trump Tower",2017-03-04 12:10:03,7,7,838119368483553281,"{'neg': 0.0, 'neu': 0.917, 'pos': 0.083, 'compound': 0.2023}",0.0534818181818,0.128545454545
52,52,Has Donald Trump been impeached yet? - 41st day in office: Not yet https://tmblr.co/Z5yASe2J99RAr ,2017-03-04 12:07:26,0,0,838118711034851333,"{'neg': 0.0, 'neu': 1.0, 'pos': 0.0, 'compound': 0.0}",0.0534818181818,0.128545454545
53,53,Alec Baldwin Is Writing A Whole Book As Fake Donald Trump |  http://nation.foxnews.com/2017/03/04/alec-baldwin-writing-whole-book-fake-donald-trump …,2017-03-04 12:05:18,0,0,838118173308248065,"{'neg': 0.237, 'neu': 0.763, 'pos': 0.0, 'compound': -0.4767}",0.0534818181818,0.128545454545
54,54,@JoeNBC  yes. Any day of the week and twice on Saturday (fav tweet day). This is lying Donald Trump you're talking about.,2017-03-04 11:54:09,3,0,838115366891061252,"{'neg': 0.13, 'neu': 0.766, 'pos': 0.103, 'compound': -0.1779}",0.0534818181818,0.128545454545
55,55,Donald Trump Questions ‘Sick Guy’ Barack Obama for ‘Wire Tapping’ His Campaign - Breitbart http://www.breitbart.com/big-government/2017/03/04/donald-trump-questions-sick-guy-barack-obama-wire-tapping-campaign/ …,2017-03-04 11:51:21,1,0,838114661153271808,"{'neg': 0.202, 'neu': 0.798, 'pos': 0.0, 'compound': -0.5106}",0.0534818181818,0.128545454545
56,56,"“Looks like President Donald Trump saw the Mark Levin report. This is VERY serious, but the left-wing anti-Trump... http://fb.me/5IqgLoKAs ",2017-03-04 11:50:02,12,10,838114330654695426,"{'neg': 0.081, 'neu': 0.833, 'pos': 0.086, 'compound': 0.0225}",0.0534818181818,0.128545454545
57,57,Donald Trump Questions 'Sick Guy' @BarackObama for 'Wire Tapping' His Campaign  http://nzzl.us/ygcMCkQ ,2017-03-04 11:27:37,0,0,838108689852682240,"{'neg': 0.231, 'neu': 0.769, 'pos': 0.0, 'compound': -0.5106}",0.0534818181818,0.128545454545
58,58,"@DabAggin #DonaldTrump you need to become familiar with laws you swore to uphold. Obama can't wiretap, only justice dept with probable cause",2017-03-04 11:23:52,1,0,838107746268512258,"{'neg': 0.117, 'neu': 0.883, 'pos': 0.0, 'compound': -0.4168}",0.0534818181818,0.128545454545
59,59,Obama EPA Head Savages Donald Trump’s Environmental Policies http://NewsUnitedStates.co.vu/1hd pic.twitter.com/P2CHX3LA1D,2017-03-04 11:16:27,1,1,838105877152309248,"{'neg': 0.298, 'neu': 0.702, 'pos': 0.0, 'compound': -0.5267}",0.0534818181818,0.128545454545
60,60,Obama EPA Head Savages Donald Trump’s Environmental Policies http://NewsUnitedStates.co.vu/1hd pic.twitter.com/mHsfkg5991,2017-03-04 11:16:16,0,1,838105833720295424,"{'neg': 0.298, 'neu': 0.702, 'pos': 0.0, 'compound': -0.5267}",0.0534818181818,0.128545454545
61,61,Chuck Schumer Just Gave Donald Trump The Biggest Gift Of His Life http://cpmlink.net/9Z8CAA pic.twitter.com/HzEkK9Ephg,2017-03-04 11:08:14,0,0,838103812934008832,"{'neg': 0.0, 'neu': 0.805, 'pos': 0.195, 'compound': 0.4404}",0.0534818181818,0.128545454545
62,62,Donald Trump was a conspiracy-theory candidate. Now he’s a conspiracy-theory president.  https://www.washingtonpost.com/news/the-fix/wp/2017/03/04/donald-trump-was-a-conspiracy-theory-candidate-now-hes-on-the-verge-of-being-a-conspiracy-theory-president/?utm_term=.f62bcb213e5a&wpisrc=nl_most-draw7&wpmm=1 …,2017-03-04 11:06:22,0,0,838103341305593856,"{'neg': 0.0, 'neu': 1.0, 'pos': 0.0, 'compound': 0.0}",0.0534818181818,0.128545454545
63,63,"Donald Trump rapped for inattention, lack of funding for Coast Guard: ‘Nonsensical’ http://fb.me/1eLcYACuE ",2017-03-04 11:02:27,0,0,838102355069571072,"{'neg': 0.161, 'neu': 0.839, 'pos': 0.0, 'compound': -0.3182}",0.0534818181818,0.128545454545
64,64,@MMFlint @realDonaldTrump  You ppl have lost your minds. The President is Donald Trump.  He understands the ppl and what they want.,2017-03-04 11:01:41,0,0,838102164941778944,"{'neg': 0.102, 'neu': 0.841, 'pos': 0.058, 'compound': -0.25}",0.0534818181818,0.128545454545
65,65,"Obama files a request with the (FISA) to monitor communications involving Donald Trump & several advisers. The request, is denied. #FISA",2017-03-04 10:54:59,8,5,838100477116100614,"{'neg': 0.139, 'neu': 0.861, 'pos': 0.0, 'compound': -0.4404}",0.0534818181818,0.128545454545
66,66,donald trump wouldn't bother me so much if he just died.,2017-03-04 10:52:19,0,0,838099806174183428,"{'neg': 0.246, 'neu': 0.615, 'pos': 0.139, 'compound': -0.3744}",0.0534818181818,0.128545454545
67,67,"BREAKING: Donald Trump DOES IT, Releases Criminal Information on Barack Obama
We're not surprised! http://www.angrypatriotmovement.com/trump-releases-criminal-information-obama/ …",2017-03-04 10:51:20,3,3,838099559289090048,"{'neg': 0.292, 'neu': 0.708, 'pos': 0.0, 'compound': -0.6551}",0.0534818181818,0.128545454545
68,68,@realDonaldTrump I'm Donald Trump. I make others feel small so I can feel bigly. Bravo.  <SMH>,2017-03-04 10:48:15,0,0,838098782847922176,"{'neg': 0.0, 'neu': 1.0, 'pos': 0.0, 'compound': 0.0}",0.0534818181818,0.128545454545
69,69,Do You Think Obama Would Wiretap Donald Trump? http://NewsUnitedStates.co.vu/1hT pic.twitter.com/bDgAOkpbhO,2017-03-04 10:39:19,1,2,838096532284960768,"{'neg': 0.0, 'neu': 1.0, 'pos': 0.0, 'compound': 0.0}",0.0534818181818,0.128545454545
70,70,Do You Think Obama Would Wiretap Donald Trump? http://NewsUnitedStates.co.vu/1hT pic.twitter.com/oSJ7SfuwRg,2017-03-04 10:39:13,0,1,838096509086269441,"{'neg': 0.0, 'neu': 1.0, 'pos': 0.0, 'compound': 0.0}",0.0534818181818,0.128545454545
71,71,SCANDAL OF THE CENTURY! Donald Trump Just Exposed Obama For HORRIBLE Crime! HERE IS THE PROOF!! http://NewsUnitedStates.co.vu/1hS pic.twitter.com/UiaAMJgYDd,2017-03-04 10:33:24,3,2,838095045890727936,"{'neg': 0.516, 'neu': 0.484, 'pos': 0.0, 'compound': -0.9304}",0.0534818181818,0.128545454545
72,72,SCANDAL OF THE CENTURY! Donald Trump Just Exposed Obama For HORRIBLE Crime! HERE IS THE PROOF!! http://NewsUnitedStates.co.vu/1hS pic.twitter.com/Jq2819TAmU,2017-03-04 10:33:21,1,2,838095030774444032,"{'neg': 0.516, 'neu': 0.484, 'pos': 0.0, 'compound': -0.9304}",0.0534818181818,0.128545454545
73,73,SCANDAL OF THE CENTURY! Donald Trump Just Exposed Obama For HORRIBLE Crime! HERE IS THE PROOF!! http://MAGA.TrumpNewss.com/4XH pic.twitter.com/hNDe9P0xR5,2017-03-04 10:33:14,6,5,838095004241309696,"{'neg': 0.516, 'neu': 0.484, 'pos': 0.0, 'compound': -0.9304}",0.0534818181818,0.128545454545
74,74,Do You Think Obama Would Wiretap Donald Trump? http://TheTrumpUsa.co.vu/4cv pic.twitter.com/bDrmeydOCD,2017-03-04 10:32:24,0,0,838094793179717632,"{'neg': 0.0, 'neu': 1.0, 'pos': 0.0, 'compound': 0.0}",0.0534818181818,0.128545454545
75,75,Do You Think Obama Would Wiretap Donald Trump? http://TheNewsbreaking.co.vu/JN pic.twitter.com/mXTnpteaYY,2017-03-04 10:32:14,0,0,838094750695616512,"{'neg': 0.0, 'neu': 1.0, 'pos': 0.0, 'compound': 0.0}",0.0534818181818,0.128545454545
76,76,SCANDAL OF THE CENTURY! Donald Trump Just Exposed Obama For HORRIBLE Crime! HERE IS THE… http://americaspaper.ml/mf  http://americaspaper.ml/X7 pic.twitter.com/YFkdhRwVgU,2017-03-04 10:32:12,0,1,838094741661085696,"{'neg': 0.505, 'neu': 0.495, 'pos': 0.0, 'compound': -0.9224}",0.0534818181818,0.128545454545
77,77,Here Are The Many Ways Donald Trump Scares The Crap Out Of Democrats http://NewsUnitedStates.co.vu/1hO pic.twitter.com/FdPBBlGZp8,2017-03-04 10:27:24,0,0,838093536503312384,"{'neg': 0.294, 'neu': 0.706, 'pos': 0.0, 'compound': -0.6124}",0.0534818181818,0.128545454545
78,78,Here Are The Many Ways Donald Trump Scares The Crap Out Of Democrats http://NewsUnitedStates.co.vu/1hO pic.twitter.com/LDWzs5EQl0,2017-03-04 10:27:22,0,1,838093527233921024,"{'neg': 0.294, 'neu': 0.706, 'pos': 0.0, 'compound': -0.6124}",0.0534818181818,0.128545454545
79,79,"Jorge Ramos: ""Donald Trump, I don't want to be your friend"" http://ln.is/uMkWS  by #jorgeramosnews via @c0nvey",2017-03-04 10:25:03,0,0,838092944502575104,"{'neg': 0.07, 'neu': 0.746, 'pos': 0.184, 'compound': 0.4548}",0.0534818181818,0.128545454545
80,80,"100% NO DOUBT : Donald Trump claims Barack Obama 'had his wires tapped in Trump Tower'
http://ln.is/www.thesun.co.uk/new/RzWWd …pic.twitter.com/YLkWcoa1ug",2017-03-04 10:20:11,17,18,838091719631597568,"{'neg': 0.306, 'neu': 0.694, 'pos': 0.0, 'compound': -0.7324}",0.0534818181818,0.128545454545
81,81,"My son is 5 years old and regularly expresses that he is disappointed in Donald Trump. When a 5 year old is more woke than many adults, Sad!",2017-03-04 10:17:38,5,2,838091078586744833,"{'neg': 0.22, 'neu': 0.78, 'pos': 0.0, 'compound': -0.7574}",0.0534818181818,0.128545454545
82,82,"NEWS ALERT , President Donald Trump Latest News Today 3/4/2017 , USA Mor... https://youtu.be/utt8OOcPSBM  via @YouTube",2017-03-04 10:12:00,1,0,838089659049721856,"{'neg': 0.0, 'neu': 0.816, 'pos': 0.184, 'compound': 0.4466}",0.0534818181818,0.128545454545
83,83,AWE! Donald Trump Was Just Caught Doing Something Super Nice For Kids! He’s An Inspiration! http://MAGA.TrumpNewss.com/4Wr pic.twitter.com/yiTxzFlMrn,2017-03-04 09:58:29,2,0,838086258299580417,"{'neg': 0.0, 'neu': 0.542, 'pos': 0.458, 'compound': 0.8996}",0.0534818181818,0.128545454545
84,84,WATCH: Donald Trump Releases Short Video and Asks EVERYONE to Watch It http://MAGA.TrumpNewss.com/4Wq pic.twitter.com/OqaTCjxArD,2017-03-04 09:58:20,3,4,838086220529848324,"{'neg': 0.0, 'neu': 1.0, 'pos': 0.0, 'compound': 0.0}",0.0534818181818,0.128545454545
85,85,Donald Trump Questions ‘Sick Guy’ Barack Obama for ‘Wire Tapping’ His Campaign - Breitbart http://www.breitbart.com/big-government/2017/03/04/donald-trump-questions-sick-guy-barack-obama-wire-tapping-campaign/ … via @BreitbartNews,2017-03-04 09:54:17,439,217,838085199791591424,"{'neg': 0.18, 'neu': 0.82, 'pos': 0.0, 'compound': -0.5106}",0.0534818181818,0.128545454545
86,86,Donald Trump Accuses 'Bad or Sick ' Barack Obama of Tapping Trump Tower https://pjmedia.com/trending/2017/03/04/donald-trump-accuses-bad-or-sick-barack-obama-of-tapping-trump-tower/ … #Trending via @pjmedia_com,2017-03-04 09:52:39,0,0,838084790331052033,"{'neg': 0.414, 'neu': 0.586, 'pos': 0.0, 'compound': -0.8481}",0.0534818181818,0.128545454545
87,87,“Trump Derangement Syndrome” Is Explained - Liberals have been driven crazy by Donald Trump and his supporters.... http://ow.ly/lBzK509XJta ,2017-03-04 09:45:48,5,9,838083068015611905,"{'neg': 0.13, 'neu': 0.87, 'pos': 0.0, 'compound': -0.34}",0.0534818181818,0.128545454545
88,88,Why Obama’s half-brother says he’ll be voting for Donald Trump | New York Post remember this!  Own family against  https://www.google.com/amp/nypost.com/2016/07/24/why-obamas-half-brother-says-hell-be-voting-for-donald-trump/amp/ …,2017-03-04 09:44:07,0,0,838082641052200960,"{'neg': 0.214, 'neu': 0.786, 'pos': 0.0, 'compound': -0.7088}",0.0534818181818,0.128545454545
89,89,Donald Trump Questions ‘Sick Guy’ Barack Obama for ‘Wire Tapping’ His Campaign - Breitbart http://www.breitbart.com/big-government/2017/03/04/donald-trump-questions-sick-guy-barack-obama-wire-tapping-campaign/ …,2017-03-04 09:39:54,0,0,838081582216937472,"{'neg': 0.202, 'neu': 0.798, 'pos': 0.0, 'compound': -0.5106}",0.0534818181818,0.128545454545
