,Text,Date,Favorites,Retweets,Tweet ID,sentiment,pos_pct,neg_pct
0,"So, you know how @POTUS's personal twitter handle is @realDonaldTrump? This right here is the real Donald Trump... https://twitter.com/DonCheadle/status/838163171055566848 …",2017-03-04 15:59:59,0,0,838177231520223233,"{'neg': 0.0, 'neu': 1.0, 'pos': 0.0, 'compound': 0.0}",0.0772894455838,0.0685520093561
1,How I did on Twitter this week: 202 New moth species named after President-elect Donald Trump's claim that he has received,2017-03-04 15:59:57,0,0,838177225711226880,"{'neg': 0.0, 'neu': 1.0, 'pos': 0.0, 'compound': 0.0}",0.0772894455838,0.0685520093561
2,"Seriously, someone with real power has to get some guts and do something about Donald Trump. Millennials can only do so much.
#WhereIsMLK",2017-03-04 15:59:56,0,0,838177220258582528,"{'neg': 0.072, 'neu': 0.928, 'pos': 0.0, 'compound': -0.1779}",0.0772894455838,0.0685520093561
3,"Roy Cohn: Donald Trump's Mentor & the Attorney for Joe McCarthy
November 14, 2016
Thread
https://twitter.com/Starseed52/status/798339264748683264 …
RECOMMEND!pic.twitter.com/Wqb7gvuBTk",2017-03-04 15:59:53,4,7,838177208787210240,"{'neg': 0.0, 'neu': 1.0, 'pos': 0.0, 'compound': 0.0}",0.0772894455838,0.0685520093561
4,The New Yorker’s David Remnick on the dangers of normalizing Donald #Trump – videohttps://www.theguardian.com/us-news/video/2017/mar/04/the-new-yorkers-david-remnick-on-the-dangers-of-normalizing-donald-trump-video?CMP=Share_AndroidApp_Tweet …,2017-03-04 15:59:52,0,1,838177205188349953,"{'neg': 0.225, 'neu': 0.775, 'pos': 0.0, 'compound': -0.4939}",0.0772894455838,0.0685520093561
5,"The Only Question Now is When Donald Trump Realized How Much Trouble He Was In 

http://www.politicususa.com/2017/03/04/question-when-donald-trump-realized-trouble.html …",2017-03-04 15:59:50,2,2,838177193406652420,"{'neg': 0.153, 'neu': 0.847, 'pos': 0.0, 'compound': -0.4019}",0.0772894455838,0.0685520093561
6,@baller4ever_8 check that video out bro but yeah I could see that as well,2017-03-04 15:59:48,0,0,838177186196533248,"{'neg': 0.0, 'neu': 0.669, 'pos': 0.331, 'compound': 0.6652}",0.0772894455838,0.0685520093561
7,"#donaldtrump @DCCC @Kmalaharris 
@Natureovations1 says: Do NOT Separate Families or leave them displaced!https://twitter.com/GillianNBC/status/838172628040888320 …",2017-03-04 15:59:48,0,0,838177185244430336,"{'neg': 0.111, 'neu': 0.889, 'pos': 0.0, 'compound': -0.126}",0.0772894455838,0.0685520093561
8,OH MY GOD! LOOK WHAT TRUMP IS DOING TO PROTECT THE JEWISH COMMUNITY! THE JEWISH COMMUNITY #donaldtrump #Judaismhttps://www.youtube.com/watch?v=c5ZXdcbfAuw&feature=share …,2017-03-04 15:59:46,0,0,838177178655174656,"{'neg': 0.0, 'neu': 0.703, 'pos': 0.297, 'compound': 0.775}",0.0772894455838,0.0685520093561
9,It Sounds Like Paul #Ryan Just Confirmed Donald #Trump’s #Wiretap Storyhttp://www.redstate.com/streiff/2017/03/04/sounds-like-paul-ryan-just-confirmed-donald-trumps-wiretap-story/ …,2017-03-04 15:59:45,0,0,838177174049984512,"{'neg': 0.0, 'neu': 0.8, 'pos': 0.2, 'compound': 0.3612}",0.0772894455838,0.0685520093561
10,Why does Donald Trump like Russians? Maybe because they love his condos http://usat.ly/2hSEMl7  via @usatoday,2017-03-04 15:59:43,1,1,838177164709277698,"{'neg': 0.0, 'neu': 0.66, 'pos': 0.34, 'compound': 0.7717}",0.0772894455838,0.0685520093561
11,"Donald Trump claims Barack Obama ordered 'wiretap' on Trump Tower, but provides no evidence | The Independent http://www.independent.co.uk/news/world/americas/us-politics/donald-trump-barack-obama-wire-tapped-trump-tower-no-evidence-a7610951.html …",2017-03-04 15:59:40,0,0,838177154344984576,"{'neg': 0.149, 'neu': 0.851, 'pos': 0.0, 'compound': -0.4215}",0.0772894455838,0.0685520093561
12,Get money like Donald trump,2017-03-04 15:59:39,0,0,838177148942811141,"{'neg': 0.0, 'neu': 0.615, 'pos': 0.385, 'compound': 0.3612}",0.0772894455838,0.0685520093561
13,"I liked a @YouTube video http://youtu.be/UMWxP-2SNG0?a  NEWS ALERT , President Donald Trump Latest News Today 3/4/17 , Democrat vs Russian",2017-03-04 15:59:39,0,0,838177148594683906,"{'neg': 0.0, 'neu': 0.709, 'pos': 0.291, 'compound': 0.694}",0.0772894455838,0.0685520093561
14,The next person who talks to me about Donald Trump gettin a haduken to the face,2017-03-04 15:59:37,0,0,838177140411596800,"{'neg': 0.0, 'neu': 1.0, 'pos': 0.0, 'compound': 0.0}",0.0772894455838,0.0685520093561
15,una pelea entre donald trump y schwarzenegger es algo épico. https://twitter.com/Schwarzenegger/status/838025579802816512 …,2017-03-04 15:59:36,1,0,838177134493503488,"{'neg': 0.0, 'neu': 1.0, 'pos': 0.0, 'compound': 0.0}",0.0772894455838,0.0685520093561
16,Donald Trump claims 'sick' Barack Obama had his 'phones tapped in Trump Tower' before US election win https://tmblr.co/ZjjUpe2J9datm ,2017-03-04 15:59:35,0,0,838177132866072576,"{'neg': 0.0, 'neu': 0.817, 'pos': 0.183, 'compound': 0.5859}",0.0772894455838,0.0685520093561
17,@baller4ever_8https://m.youtube.com/watch?v=_jjA6ZL0Z_k …,2017-03-04 15:59:35,0,0,838177132144541696,"{'neg': 0.0, 'neu': 1.0, 'pos': 0.0, 'compound': 0.0}",0.0772894455838,0.0685520093561
18,"Cientos de personas dan apoyo a Donald Trump, en diversas marchas celebradas en el país, incluso frente a su residencia de Mar-a-Lago (Fl). pic.twitter.com/cPuBVfnDgc",2017-03-04 15:59:33,0,0,838177124238389248,"{'neg': 0.0, 'neu': 1.0, 'pos': 0.0, 'compound': 0.0}",0.0772894455838,0.0685520093561
19,Donald Trump raccontato tramite i suoi domini internet http://fb.me/1OiRXI8fk ,2017-03-04 15:59:31,0,0,838177114293682176,"{'neg': 0.0, 'neu': 1.0, 'pos': 0.0, 'compound': 0.0}",0.0772894455838,0.0685520093561
20,Do we remember this?  Donald Trump Calls on Russia to Find Hillary Clinton’s Missing Emails https://nyti.ms/2ausQ98 ,2017-03-04 15:59:28,2,0,838177101056462849,"{'neg': 0.128, 'neu': 0.872, 'pos': 0.0, 'compound': -0.296}",0.0772894455838,0.0685520093561
21,"Rally in Cleveland for Donald Trump spirited, but peaceful - http://cleveland.com  -  https://donaldtrumpleak.com/rally-in-cleveland-for-donald-trump-spirited-but-peaceful-cleveland-com/ …pic.twitter.com/B7x4RMFAGz",2017-03-04 15:59:28,19,18,838177100574097408,"{'neg': 0.0, 'neu': 0.602, 'pos': 0.398, 'compound': 0.714}",0.0772894455838,0.0685520093561
22,Poll: Do you believe Barack Obama wiretapped Donald Trump?;  https://goo.gl/Qqj9xD  #poll via @opinionstage,2017-03-04 15:59:26,0,0,838177092168728576,"{'neg': 0.0, 'neu': 1.0, 'pos': 0.0, 'compound': 0.0}",0.0772894455838,0.0685520093561
23,"In a ""lighter"" side of life, some @lifetimetv movies go hard on why you should not get a live-in nanny. Great release from #DonaldTrump BS",2017-03-04 15:59:24,0,0,838177086015750145,"{'neg': 0.053, 'neu': 0.792, 'pos': 0.155, 'compound': 0.5719}",0.0772894455838,0.0685520093561
24,I fucked my dad because it nipple crippled Donald Trump.,2017-03-04 15:59:15,0,0,838177046887084032,"{'neg': 0.355, 'neu': 0.645, 'pos': 0.0, 'compound': -0.6597}",0.0772894455838,0.0685520093561
25,Island girl Donald trump want me to go home,2017-03-04 15:59:14,0,0,838177041988136960,"{'neg': 0.0, 'neu': 0.86, 'pos': 0.14, 'compound': 0.0772}",0.0772894455838,0.0685520093561
26,More lies of course! Donald Trump is an impressive student of political weasel wording http://www.motherjones.com/kevin-drum/2017/03/donald-trump-impressive-student-political-weasel-wording … #TrumpIsAMoron,2017-03-04 15:59:10,0,0,838177028155314178,"{'neg': 0.15, 'neu': 0.677, 'pos': 0.174, 'compound': 0.1278}",0.0772894455838,0.0685520093561
27,BREAKING: Donald Trump Makes Move to TAKE NANCY PELOSI DOWN. Do You Support It? http://NewsUpdatee.co.vu/1HO pic.twitter.com/GGueZGklLH,2017-03-04 15:59:08,17,4,838177019741405184,"{'neg': 0.0, 'neu': 0.838, 'pos': 0.162, 'compound': 0.4019}",0.0772894455838,0.0685520093561
28,BREAKING: Donald Trump Makes Move to TAKE NANCY PELOSI DOWN. Do You Support It? http://USATrump.co.vu/5YC pic.twitter.com/Z6JKhX8KvZ,2017-03-04 15:59:05,2,1,838177007171072001,"{'neg': 0.0, 'neu': 0.838, 'pos': 0.162, 'compound': 0.4019}",0.0772894455838,0.0685520093561
29,if you ask donald trump what the internet is.,2017-03-04 15:59:05,0,0,838177005187235841,"{'neg': 0.0, 'neu': 1.0, 'pos': 0.0, 'compound': 0.0}",0.0772894455838,0.0685520093561
30,BREAKING: Donald Trump Makes Move to TAKE NANCY PELOSI DOWN. Do You Support It? http://USATrump.co.vu/5YC pic.twitter.com/ojkXrfFdLH,2017-03-04 15:59:04,40,12,838177001647177728,"{'neg': 0.0, 'neu': 0.838, 'pos': 0.162, 'compound': 0.4019}",0.0772894455838,0.0685520093561
31,Did Donald Trump's accusations of Barack Obama 'wiretapping' stem from news report by Louise Mensch? http://www.telegraph.co.uk/news/2017/03/04/did-donald-trumps-accusations-barack-obama-wiretapping-stem/ …,2017-03-04 15:59:03,0,0,838176997868195840,"{'neg': 0.133, 'neu': 0.867, 'pos': 0.0, 'compound': -0.3182}",0.0772894455838,0.0685520093561
32,Did President Obama Spy On Donald Trump? | True News http://ln.is/www.youtube.com/f7Wqw … via @YouTube,2017-03-04 15:59:01,0,0,838176990268125186,"{'neg': 0.0, 'neu': 0.797, 'pos': 0.203, 'compound': 0.4215}",0.0772894455838,0.0685520093561
33,BREAKING: Donald Trump Makes Move to TAKE NANCY PELOSI DOWN. Do You Support It? http://NewsUpdatee.co.vu/1HO pic.twitter.com/Pr2EwHLIMN,2017-03-04 15:58:59,331,180,838176982948990976,"{'neg': 0.0, 'neu': 0.838, 'pos': 0.162, 'compound': 0.4019}",0.0772894455838,0.0685520093561
34,@CBSNews Mike Pence and Donald Trump haven't seen anything yet!!  like Marco Rubio said Republicans be careful we could be next Wikileaks.. part 2.,2017-03-04 15:58:59,8,1,838176980168232964,"{'neg': 0.0, 'neu': 0.824, 'pos': 0.176, 'compound': 0.5696}",0.0772894455838,0.0685520093561
35,"I liked a @YouTube video http://youtu.be/H2ut8ChPwdI?a  Donald Trump Loves Saying ""Donald Trump""",2017-03-04 15:58:58,0,0,838176977307717640,"{'neg': 0.0, 'neu': 0.552, 'pos': 0.448, 'compound': 0.7579}",0.0772894455838,0.0685520093561
36,Paranoid politics: how does Donald Trump get away with it? http://theconversation.com/paranoid-politics-how-does-donald-trump-get-away-with-it-64157 … via @ConversationEDU. By his age he ought to know better,2017-03-04 15:58:55,0,1,838176963563044866,"{'neg': 0.084, 'neu': 0.795, 'pos': 0.121, 'compound': 0.2263}",0.0772894455838,0.0685520093561
37,"Donald TRUMP ACLARA conceptos al MUNDO, ""en EEUU hay 93 millones de DESEMPLEADOS y 43 millones en POBREZA EXTREMA"", a la JAIBA, pobre PAIS pic.twitter.com/F2OF7yPg49",2017-03-04 15:58:50,10,47,838176944353050629,"{'neg': 0.0, 'neu': 1.0, 'pos': 0.0, 'compound': 0.0}",0.0772894455838,0.0685520093561
38,SCANDAL OF THE CENTURY! Donald Trump Just Exposed Obama for HORRIBLE Crime! HERE IS THE PROOF!! https://libertywritersnews.com/?p=23861  via @liberty_writers,2017-03-04 15:58:48,0,0,838176934064377856,"{'neg': 0.48, 'neu': 0.52, 'pos': 0.0, 'compound': -0.9304}",0.0772894455838,0.0685520093561
39,Donald #Trump isn’t the only villain – the #RepublicanParty shares the blamehttps://www.theguardian.com/commentisfree/2017/mar/03/donald-trump-villain-republican-party-blame-russia?CMP=Share_AndroidApp_Tweet …,2017-03-04 15:58:46,1,1,838176926191644672,"{'neg': 0.0, 'neu': 0.637, 'pos': 0.363, 'compound': 0.6278}",0.0772894455838,0.0685520093561
40,@Donald_Trump_0 Of course they did. They wouldn't recognize the truth if it was set in front of them! Blind and stupid!,2017-03-04 15:58:46,0,0,838176924514009088,"{'neg': 0.324, 'neu': 0.676, 'pos': 0.0, 'compound': -0.8246}",0.0772894455838,0.0685520093561
41,They just READ Donald Trump for filth!! #ALLTNOSHADEhttp://www.newyorker.com/magazine/2017/02/27/holding-trump-accountable …,2017-03-04 15:58:37,0,0,838176890540154885,"{'neg': 0.0, 'neu': 1.0, 'pos': 0.0, 'compound': 0.0}",0.0772894455838,0.0685520093561
42,Sources: Donald Trump Listened In On Phone Lines At Mar-A-Lago #fakedonaldtrump evil twin @realDonaldTrump PARANOIDhttps://www.buzzfeed.com/aramroston/sources-donald-trump-listened-in-on-phone-lines-at-mar-a-lag?utm_term=.evg4pP588B#.evg4pP588B …,2017-03-04 15:58:37,0,0,838176890502299648,"{'neg': 0.239, 'neu': 0.761, 'pos': 0.0, 'compound': -0.6597}",0.0772894455838,0.0685520093561
43,"In an unsettling world, my column on how to talk to your adult about Donald Trump: http://www.macleans.ca/politics/washington/a-childrens-guide-to-parenting-in-the-world-of-trump/ …",2017-03-04 15:58:37,16,13,838176890116521984,"{'neg': 0.0, 'neu': 1.0, 'pos': 0.0, 'compound': 0.0}",0.0772894455838,0.0685520093561
44,Espero que Donald Trump las deporte JAJAJAJAJAJAJJA https://twitter.com/ceciicass/status/838173288060829697 …,2017-03-04 15:58:35,3,2,838176881623060480,"{'neg': 0.0, 'neu': 1.0, 'pos': 0.0, 'compound': 0.0}",0.0772894455838,0.0685520093561
45,"VIDEO: Scuffles, Fistfights Rrupt as PRO and Anti-Trump Rallies Clash in Berkeley http://dailywesterner.com/news/2017-03-04/video-scuffles-fistfights-rrupt-as-pro-and-anti-trump-rallies-clash-in-berkeley/ … #berkeley #donaldtrump #riot",2017-03-04 15:58:33,0,0,838176870382383106,"{'neg': 0.0, 'neu': 1.0, 'pos': 0.0, 'compound': 0.0}",0.0772894455838,0.0685520093561
46,Donald Trump é muito chato pqp,2017-03-04 15:58:32,1,0,838176869459558403,"{'neg': 0.0, 'neu': 1.0, 'pos': 0.0, 'compound': 0.0}",0.0772894455838,0.0685520093561
47,SIN CENSURA....DONALD TRUMP (DOCUMENTAL COMPLETO EN ESPAÑOL) https://youtu.be/dkuygxWOkAc  vía @YouTube,2017-03-04 15:58:32,2,1,838176868931100672,"{'neg': 0.325, 'neu': 0.675, 'pos': 0.0, 'compound': -0.6523}",0.0772894455838,0.0685520093561
48,Le porte-parole de Barack Obama dément que Donald Trump a été mis sur écoute http://www.lemonde.fr/donald-trump/article/2017/03/04/donald-trump-accuse-barack-obama-de-l-avoir-mis-sur-ecoute_5089358_4853715.html …,2017-03-04 15:58:30,0,0,838176861159063552,"{'neg': 0.0, 'neu': 1.0, 'pos': 0.0, 'compound': 0.0}",0.0772894455838,0.0685520093561
49,Never read donald trump fanfics (by mistake),2017-03-04 15:58:29,2,0,838176853672267776,"{'neg': 0.0, 'neu': 1.0, 'pos': 0.0, 'compound': 0.0}",0.0772894455838,0.0685520093561
50,Miss USA Credits Donald Trump for Saving Her Life http://www.truthrevolt.org/news/miss-usa-credits-donald-trump-saving-her-life#.WLtUiz7dUNc.twitter …,2017-03-04 15:58:26,1,0,838176841953345536,"{'neg': 0.132, 'neu': 0.661, 'pos': 0.207, 'compound': 0.2263}",0.0772894455838,0.0685520093561
51,The two faces of US President Donald Trump - The Listening Post (Lead) https://youtu.be/I8US-KfmokU  @YouTubeさんから,2017-03-04 15:58:24,1,0,838176835422736384,"{'neg': 0.0, 'neu': 1.0, 'pos': 0.0, 'compound': 0.0}",0.0772894455838,0.0685520093561
52,El fracaso de 'The Apprentice' no fue mi culpa: Donald Trump http://mile.io/2m5YvBa pic.twitter.com/4AxDJgUWQg,2017-03-04 15:58:23,0,0,838176829924077570,"{'neg': 0.167, 'neu': 0.833, 'pos': 0.0, 'compound': -0.296}",0.0772894455838,0.0685520093561
53,Donald Trump is peace versus Hillary and Obama representing hate & will do anything to keep monsters in power including abusing power. #FISApic.twitter.com/1cWvpk7pgq,2017-03-04 15:58:21,0,0,838176821057290241,"{'neg': 0.229, 'neu': 0.651, 'pos': 0.12, 'compound': -0.4939}",0.0772894455838,0.0685520093561
54,Religious #Extremism and Mischief of #Dajjal #AntiChrist http://pos.li/BzAn  #ISIS #ISIS #Taliban #AlShabab #Islam #DonaldTrump,2017-03-04 15:58:16,0,0,838176799871893504,"{'neg': 0.161, 'neu': 0.839, 'pos': 0.0, 'compound': -0.3612}",0.0772894455838,0.0685520093561
55,The Reality of #Wahhabism in #Islam http://pos.li/BDSH  #SaudiArabia #Salafism #Deobandi #ISIS #Taliban #AlQaeda #DonaldTrump #MikePence,2017-03-04 15:58:16,0,0,838176799397986304,"{'neg': 0.0, 'neu': 1.0, 'pos': 0.0, 'compound': 0.0}",0.0772894455838,0.0685520093561
56,‘House of Cards’ creator pleads with Twitter to delete Donald Trump’s account https://ca.news.yahoo.com/house-cards-creator-pleads-twitter-212933137.html?soc_src=social-sh&soc_trk=tw … via @YahooCanada,2017-03-04 15:58:13,1,0,838176787955757056,"{'neg': 0.0, 'neu': 1.0, 'pos': 0.0, 'compound': 0.0}",0.0772894455838,0.0685520093561
57,Donald Trump is mentally ill,2017-03-04 15:58:11,1,0,838176780565561344,"{'neg': 0.412, 'neu': 0.588, 'pos': 0.0, 'compound': -0.4215}",0.0772894455838,0.0685520093561
58,Descobri que Donald Trump e eu temos algo em comum: os dois passam o dia falando merda no Twitter.,2017-03-04 15:58:11,0,0,838176778183131136,"{'neg': 0.121, 'neu': 0.879, 'pos': 0.0, 'compound': -0.296}",0.0772894455838,0.0685520093561
59,"BREAKING: Donald Trump Makes Move to TAKE NANCY PELOSI DOWN. Do You Support It?

Hell YES!! http://www.angrypatriotmovement.com/trump-moves-against-pelosi/ …",2017-03-04 15:58:10,0,0,838176775980998656,"{'neg': 0.182, 'neu': 0.553, 'pos': 0.265, 'compound': 0.2771}",0.0772894455838,0.0685520093561
60,"Me:*walks into room*
Dad: ""DONALD TRUMP""",2017-03-04 15:58:09,5,0,838176771073781760,"{'neg': 0.0, 'neu': 1.0, 'pos': 0.0, 'compound': 0.0}",0.0772894455838,0.0685520093561
61,It Sounds Like Paul Ryan Just Confirmed Donald Trump’s Wiretap Story http://dlvr.it/NXjL9J pic.twitter.com/EXws3ZunTU,2017-03-04 15:58:08,0,0,838176765826617344,"{'neg': 0.0, 'neu': 0.815, 'pos': 0.185, 'compound': 0.3612}",0.0772894455838,0.0685520093561
62,It Sounds Like #PaulRyan Just Confirmed #DonaldTrump’s Wiretap Story http://viid.me/qb24OE pic.twitter.com/m8Kc1hgLal,2017-03-04 15:58:06,0,0,838176759841357824,"{'neg': 0.0, 'neu': 0.783, 'pos': 0.217, 'compound': 0.3612}",0.0772894455838,0.0685520093561
63,Donald Trump has spent almost a third of his days as President in Mar-a-Lago http://www.independent.co.uk/news/world/americas/donald-trump-spent-almost-third-time-office-mar-a-lago-resort-palm-beach-florida-a7611326.html …,2017-03-04 15:58:03,0,0,838176745735933952,"{'neg': 0.0, 'neu': 1.0, 'pos': 0.0, 'compound': 0.0}",0.0772894455838,0.0685520093561
64,"Donald Trump Wiki, Biography, Net Worth, Wife Contact Details http://www.officeaddresshelplinenumber.com/donald-trump-wiki-biography-net-worth-wife-contact-details/?utm_source=ReviveOldPost&utm_medium=social&utm_campaign=ReviveOldPost …",2017-03-04 15:58:01,0,0,838176739134164992,"{'neg': 0.0, 'neu': 0.826, 'pos': 0.174, 'compound': 0.2263}",0.0772894455838,0.0685520093561
65,"Photos ‘Prove’ Donald Trump Is Time Traveller John Titor
http://yournewswire.com/donald-trump-john-titor/ …",2017-03-04 15:57:59,0,0,838176731181690881,"{'neg': 0.0, 'neu': 1.0, 'pos': 0.0, 'compound': 0.0}",0.0772894455838,0.0685520093561
66,"#DonaldTrump , put a tax on monies wired to central and South America by non-citizens or by anyone that can not prove legal residency.",2017-03-04 15:57:58,0,0,838176724454096896,"{'neg': 0.061, 'neu': 0.939, 'pos': 0.0, 'compound': -0.0951}",0.0772894455838,0.0685520093561
67,"Donald Trump fact check: His claims about NATO, jobs, military, immigration are mostly false http://glbn.ca/pcdHsB pic.twitter.com/iYHinBqlLK",2017-03-04 15:57:54,4,3,838176709421711361,"{'neg': 0.0, 'neu': 1.0, 'pos': 0.0, 'compound': 0.0}",0.0772894455838,0.0685520093561
68,"Adding Donald Trump, Kellyanne Conway, Mike Pence, and Sean Spicer... this is about to get really funny.",2017-03-04 15:57:50,2,0,838176692900347904,"{'neg': 0.0, 'neu': 0.834, 'pos': 0.166, 'compound': 0.4927}",0.0772894455838,0.0685520093561
69,I swear all adults over the age of 35 talk about is Donald Trump,2017-03-04 15:57:47,0,0,838176680145469441,"{'neg': 0.091, 'neu': 0.909, 'pos': 0.0, 'compound': -0.0516}",0.0772894455838,0.0685520093561
70,Donald Trump Manages Not to Offend Anyone in Pre-Inaugural Address http://dld.bz/f2EWg  #Filmmaking ?,2017-03-04 15:57:47,0,0,838176678966935552,"{'neg': 0.167, 'neu': 0.833, 'pos': 0.0, 'compound': -0.296}",0.0772894455838,0.0685520093561
71,PRESIDENTIAL DUTIES #bkhammoproductions #instagram #chipspice #donaldtrump… https://www.instagram.com/p/BRPEbVOBmNS/ ,2017-03-04 15:57:44,0,0,838176668275494912,"{'neg': 0.0, 'neu': 1.0, 'pos': 0.0, 'compound': 0.0}",0.0772894455838,0.0685520093561
72, Democrat Leader PAID for Russians to Hack Trump. Media REFUSES to Spread This. http://POTUS.TrumpNewss.com/JbE pic.twitter.com/Rm68b5F7yq,2017-03-04 15:57:40,4,4,838176647547277313,"{'neg': 0.0, 'neu': 1.0, 'pos': 0.0, 'compound': 0.0}",0.0772894455838,0.0685520093561
73,Blair illegally invades Iraq had Dr David kelly murdered failed as middle east envoy n resigned but now wants to work for Donald trump/fart,2017-03-04 15:57:39,0,0,838176645995462656,"{'neg': 0.241, 'neu': 0.759, 'pos': 0.0, 'compound': -0.6542}",0.0772894455838,0.0685520093561
74,Donald Trump's first 100 days as president – daily updates http://24newsusa.ml/196 pic.twitter.com/aF9a1ZDE6B,2017-03-04 15:57:39,0,0,838176645223612416,"{'neg': 0.0, 'neu': 1.0, 'pos': 0.0, 'compound': 0.0}",0.0772894455838,0.0685520093561
75,Dying Author Writes Death Bed Essay Encouraging Women to Date Her Husband After She Dies http://www.breitbart.com/big-journalism/2017/03/04/dying-author-writes-death-bed-essay-encouraging-women-date-husband-after-dies/?utm_source=dlvr.it&utm_medium=twitter …pic.twitter.com/JcgY5rtQx9,2017-03-04 15:57:39,0,0,838176644615417857,"{'neg': 0.183, 'neu': 0.657, 'pos': 0.16, 'compound': -0.128}",0.0772894455838,0.0685520093561
76,Nevada Gov. Brian Sandoval asks President Donald Trump to extend disaster declaration http://dlvr.it/NXjKpB  #vegas #lasvegas #lvrjpic.twitter.com/HWtlOF1E2v,2017-03-04 15:57:39,0,0,838176644523143168,"{'neg': 0.207, 'neu': 0.707, 'pos': 0.086, 'compound': -0.5267}",0.0772894455838,0.0685520093561
77,"Huge YouTuber HARMS Self? iDubbbz, Donald Trump ROASTED by Matthew Santoro",2017-03-04 15:57:39,0,0,838176643583705089,"{'neg': 0.258, 'neu': 0.591, 'pos': 0.151, 'compound': -0.3885}",0.0772894455838,0.0685520093561
78,BREAKING: Donald Trump Makes Move to TAKE NANCY PELOSI DOWN. Do You Support It? http://POTUS.TrumpNewss.com/JbD pic.twitter.com/s46S0Ri1Iv,2017-03-04 15:57:38,6,2,838176642413404161,"{'neg': 0.0, 'neu': 0.838, 'pos': 0.162, 'compound': 0.4019}",0.0772894455838,0.0685520093561
79,Donald Trump's first 100 days as president – daily updates http://pencenews.ga/Da8 pic.twitter.com/XkvDdVdWUS,2017-03-04 15:57:38,0,0,838176639427063808,"{'neg': 0.0, 'neu': 1.0, 'pos': 0.0, 'compound': 0.0}",0.0772894455838,0.0685520093561
80,Donald Trump's first 100 days as president – daily updates http://newstheguartian.cf/Lq pic.twitter.com/HlPjyXegSI,2017-03-04 15:57:38,0,0,838176639288655873,"{'neg': 0.0, 'neu': 1.0, 'pos': 0.0, 'compound': 0.0}",0.0772894455838,0.0685520093561
81,"""Donald Trump is who we thought he was."" https://twitter.com/washingtonpost/status/838039661452865536 …",2017-03-04 15:57:37,0,0,838176637179023362,"{'neg': 0.0, 'neu': 1.0, 'pos': 0.0, 'compound': 0.0}",0.0772894455838,0.0685520093561
82,Donald Trump's first 100 days as president – daily updates http://pencenews.cf/ar   see herepic.twitter.com/T3oBOSNJrD,2017-03-04 15:57:37,0,0,838176636126158849,"{'neg': 0.0, 'neu': 1.0, 'pos': 0.0, 'compound': 0.0}",0.0772894455838,0.0685520093561
83,"Woman, 88, Talks Man Out of Raping Her by Saying She Is HIV-Positive http://www.breitbart.com/big-government/2017/03/04/woman-88-talks-man-out-of-raping-her-by-saying-she-is-hiv-positive/?utm_source=dlvr.it&utm_medium=twitter …pic.twitter.com/WLTYkqILzu",2017-03-04 15:57:34,3,1,838176625778831361,"{'neg': 0.27, 'neu': 0.73, 'pos': 0.0, 'compound': -0.7003}",0.0772894455838,0.0685520093561
84,#ObamaGate is a stupid trend started by the basket of deplorables to distract us from Donald Trump's corruption. #russiagate #ImpeachTrump,2017-03-04 15:57:32,1,0,838176614244470784,"{'neg': 0.248, 'neu': 0.752, 'pos': 0.0, 'compound': -0.6808}",0.0772894455838,0.0685520093561
85,@JoyAnnReid I hear Donald Trump is hiring,2017-03-04 15:57:31,0,0,838176612537491457,"{'neg': 0.0, 'neu': 1.0, 'pos': 0.0, 'compound': 0.0}",0.0772894455838,0.0685520093561
86,Christian Bakers Who ‘Lost Everything’ for Refusing Gay Wedding Cake Appeal Verdict http://www.breitbart.com/big-government/2017/03/04/christian-bakers-lost-everything-refusing-gay-wedding-cake-appeal-verdict/?utm_source=dlvr.it&utm_medium=twitter …pic.twitter.com/GJI3gzA1c5,2017-03-04 15:57:31,2,0,838176609974669312,"{'neg': 0.301, 'neu': 0.602, 'pos': 0.096, 'compound': -0.5267}",0.0772894455838,0.0685520093561
87,"""Some people are calling it a big bang. But I've banged bigger. Sad really."" 
- Donald Trump as a cosmological physicist.",2017-03-04 15:57:26,55,23,838176590987214849,"{'neg': 0.154, 'neu': 0.846, 'pos': 0.0, 'compound': -0.4767}",0.0772894455838,0.0685520093561
88,@mattkeeny Donald Trump just tweeted #FakeFight,2017-03-04 15:57:25,0,0,838176588583878656,"{'neg': 0.0, 'neu': 1.0, 'pos': 0.0, 'compound': 0.0}",0.0772894455838,0.0685520093561
89,"Study: Breitbart Dominated Right Wing Coverage, ‘Altered Media Agenda’ In 2016 http://www.breitbart.com/tech/2017/03/04/study-breitbart-led-right-wing-media-ecosystem-altered-media-agenda/?utm_source=dlvr.it&utm_medium=twitter …pic.twitter.com/L1GpBQezfV",2017-03-04 15:57:24,0,0,838176583118528512,"{'neg': 0.0, 'neu': 1.0, 'pos': 0.0, 'compound': 0.0}",0.0772894455838,0.0685520093561
90,"June 2016: FISA request. Obama administration files a request with the FISA court to monitor communications involving Donald Trump, WHY",2017-03-04 15:57:21,1,0,838176570770657282,"{'neg': 0.0, 'neu': 1.0, 'pos': 0.0, 'compound': 0.0}",0.0772894455838,0.0685520093561
91,Donald Trump Is an Impressive Student of Political Weasel Wording | Mother Jones http://m.motherjones.com/kevin-drum/2017/03/donald-trump-impressive-student-political-weasel-wording …,2017-03-04 15:57:21,0,0,838176568438571011,"{'neg': 0.0, 'neu': 0.784, 'pos': 0.216, 'compound': 0.5106}",0.0772894455838,0.0685520093561
