Text,Date,Favorites,Retweets,Tweet ID
Largest bridge ever to have a solid foundation laid was laid last night by Pres.Donald Trump before Congress for Democrats an Republicans,2017-03-01 15:10:11,0,0,837077538329477121
@ChrisCuomo Donald Trump; faithless and accursed.,2017-03-01 12:35:47,0,0,837038679071784961
"Donald Trump killed it last night 
CNN response ""the virus is evolving""",2017-03-01 12:32:41,0,0,837037902290948097
CNN just called Donald Trump Kobe Bryant without knowing it,2017-03-01 12:28:34,0,0,837036864372629504
WOW - truth bomb....Van Jones: Donald Trump Became President of the United States Tonight https://youtu.be/oMspOEVxWfM  via @YouTube,2017-03-01 09:55:09,0,0,836998254873231362
Donald Trump attains majority disapproval rating in record time in the opening months of his Administration. https://twitter.com/realdonaldtrump/status/836933725602656256 …,2017-03-01 09:49:25,2,0,836996812112293888
Former Mexican President Vicente Fox Says He'll Pay For Donald Trump's Wall - The Huffington Post https://apple.news/AGw8YS5PHQHqNUngJLqa0Cw …,2017-03-01 09:03:56,0,0,836985367727386625
Idiot Nancy Pelosi: 'Very proud' of the 'dignity' Democrats showed during Donald Trump's speech http://conservativenews247.com/article/view/362055/Nancy-Pelosi-Very-proud-of-the-dignity-Democrats-showed-during-Donald-Trumps-speech …,2017-03-01 08:48:48,0,0,836981558808543232
"Hillary Staffer Attacks Fallen SEAL's Wife, Instantly Gets Called Out Donald Trump Jr... http://fb.me/78DEyxvxt ",2017-03-01 08:24:56,0,0,836975553513197572
