Text,Date,Favorites,Retweets,Tweet ID
#Sessions #donaldtrump #benghazi #fastandfurious #IRSGate #BabyParts #fthood #Media #ChuckyDollSchumer #InvestigateObamahttps://twitter.com/ten_gop/status/837457662883221507 …,2017-03-03 15:42:40,0,0,837810485521047554
Donald Trump's attempt to shift Russia focus to Chuck Schumer is more than a little desperate http://www.huffingtonpost.com/entry/donald-trump-chuck-schumer-russia_us_58b9b656e4b05cf0f40060d4?ncid=engmodushpmg00000004 … via @HuffPostPol,2017-03-03 15:23:46,0,0,837805729301975040
Michael Moore's 5-point plan for 2017 (and Donald Trump) http://www.msnbc.com/the-last-word/watch/michael-moore-s-5-point-plan-for-2017-and-donald-trump-840016963621 … via @msnbc,2017-03-03 14:52:06,0,0,837797762531897344
Sen. Perdue: Democrats Are 'Focused on Sabotaging' Donald Trump - Breitbart http://www.breitbart.com/big-government/2017/03/02/senator-perdue-democrats-sabotaging-trump-sessions/ …,2017-03-03 14:47:25,23,43,837796584679100416
Bernie Sanders just delivered a scathing response to Donald Trump's first address to Congress http://www.motherjones.com/politics/2017/02/bernie-sanders-donald-trump-congress-speech … via @motherjones,2017-03-03 14:38:46,0,0,837794406652502016
"Oregonian: Arnold Schwarzenegger exits 'Celebrity Apprentice,' and its Donald Trump 'baggage' … pic.twitter.com/bp6M0f82QN",2017-03-03 14:22:21,0,0,837790276181712896
via @TheEconomist Dazed and recused: Donald Trump’s latest Russia scandal http://www.economist.com/blogs/democracyinamerica/2017/03/dazed-and-recused?cid1=cust/ddnew/n/n/n/2017033n/owned/n/n/nwl/n/n/n/email …,2017-03-03 14:19:04,0,0,837789449220046848
My hand to God: Donald Trump has the emotional maturity of a 3rd grader. https://twitter.com/CNN/status/837788676562235393 …,2017-03-03 14:17:11,2,1,837788976169668609
Donald Trump: Good Education ‘Enriches Both the Mind and the Soul’ http://dlvr.it/NXHDKF pic.twitter.com/rNchKntGqS,2017-03-03 14:03:44,0,0,837785589961273344
Why Fox News just can’t quit Donald Trump - Vox http://www.vox.com/videos/2017/3/3/14802304/strikethrough-fox-news-donald-trump-rupert-murdoch-hannity …,2017-03-03 13:28:58,0,0,837776839493877762
"NEW VIDEO: Donald Trump ""will never be president"" | Donald Trump IS YOUR PRESIDENT https://youtu.be/4gqatewYsOU  via @YouTube
#politics #Trump",2017-03-03 13:16:51,0,0,837773792415907840
Homeland Security Still Doesn't Think Donald Trump's Immigration Order Will Work | The Huffington Po http://pinterest.com/pin/153474299782779088/ …,2017-03-03 13:05:28,0,0,837770926422966274
"Trump Fact 42: #DonaldTrump, for inappropriate use of the #StankyLegg, was the first 60 year old to go to juvy. @realDonaldTrump #trumpfacts",2017-03-03 12:49:01,0,1,837766784992296961
@SenSchumer What is the Democratic party hiding?? Why are you so affraid of Donald Trump?,2017-03-03 11:28:03,0,0,837746409394733057
Donald Trump makes me miss George W. Bush like Uwe Boll makes me miss Ed Wood.,2017-03-03 11:07:54,0,0,837741340708368384
"""You have to have the bile in your throat."" For Donald Trump, that's probably like drinking wine. https://twitter.com/Deadline/status/837728596898697216 …",2017-03-03 10:22:11,0,0,837729834629419008
Is Donald Trump ‘Mr. Brexit’? https://nyti.ms/2jGlvVk ,2017-03-03 10:13:22,0,0,837727614181629952
"Donald Trump ""will never be president"" | Donald Trump IS YOUR PRESIDENT https://youtu.be/4gqatewYsOU  via @YouTube
#FlashbackFriday",2017-03-03 09:18:26,0,0,837713790334480384
Donald Trump is Ruprecht from Dirty Rotten Scoundrels.,2017-03-03 08:59:06,0,0,837708924920844289
I think it's time for Donald Trump to recuse himself from POTUS.,2017-03-03 08:42:51,1,0,837704836393000965
"LOVE! My 6-year-old keeps asking ""Did you get Donald Trump fired yet, Mom?"" https://twitter.com/tarastrong/status/837698934998851584 …",2017-03-03 08:30:34,2,0,837701747225186305
"Donald Trump ""will never be president"" | Donald Trump IS YOUR PRESIDENT https://youtu.be/4gqatewYsOU  via @YouTube
@POTUS @realDonaldTrump",2017-03-03 08:22:11,0,0,837699634084532224
Donald Trump refuses to release birth certificate and passport records | US news | The Guardian https://www.google.com/amp/s/amp.theguardian.com/us-news/2015/jun/26/donald-trump-refuses-release-birth-certificate-passport-records …,2017-03-03 08:19:36,1,1,837698985167048705
"@solaraguy11 @schumik7777 @POTUS ..Donald Trump on pace to play twice as much golf as president than Barack Obama
http://www.metro.us/sports/donald-trump-on-pace-to-play-twice-as-much-golf-as-president-than-barack-obama/zsJqbv---uklUTLVO4oe1Y/ …",2017-03-03 08:03:55,2,1,837695040751202305
Trump-Russia conspirator J.D. Gordon begins ratting out Donald Trump http://www.palmerreport.com/opinion/trump-russia-conspirator-j-d-gordon-begins-ratting-donald-trump/1747/ … via @PalmerReport,2017-03-03 07:52:45,0,0,837692226440327169
"Former Miss USA speaks out about Donald Trump, ten years later - https://goo.gl/iVMBUh  via @realstaceydash",2017-03-03 07:33:08,1,0,837687292852482048
The Democrats Are Teaming Up With This Terrorist To Take Out Donald Trump http://www.americanpatriotdaily.com/latest/democrats-teaming-with-terrorist-take-out-trump/ …,2017-03-03 07:26:56,0,0,837685731384418305
"Did Donald Trump just sink Jeff Sessions? http://www.msnbc.com/the-last-word/watch/did-donald-trump-just-sink-jeff-sessions-889121859656 … via @msnbc
#RealNews",2017-03-03 06:26:38,0,0,837670558313533440
Why do I follow Donald trump lol,2017-03-03 06:17:47,0,0,837668328827125760
Donald Trump Nominated For Nobel Peace Award http://entadaplace.com/donald-trump-nominated-nobel-peace-award/ …,2017-03-03 02:52:47,0,0,837616741312315393
Us gulf allies look to donald trump with hope and uncertainty _ world-news _ hindustan times,2017-03-03 02:10:06,0,0,837605996038139904
"We won the election by almost three million votes, you Russian stooge.
Get over that insane Donald 
(#Trump/.@potus/.@realDonaldTrump)https://twitter.com/realDonaldTrump/status/837491607171629057 …",2017-03-03 01:06:33,0,0,837590004046049281
@abbieegan_ (exaggeration bc i could think of 100 things i hate more than that ((donald trump)) but i rlly do hate that ^),2017-03-02 23:34:11,5,0,837566761872416768
@Jewerstein Donald Trump has little dick,2017-03-02 22:53:53,0,0,837556619030364161
@realDonaldTrump Please remember not all CRNAS are liberal! I have a Donald Trump sign on my property. My wife and I are  huge fans MAGA!,2017-03-02 22:24:10,0,0,837549139873288192
Donald trump,2017-03-02 22:19:19,0,0,837547919074975748
Donald Trump is just another Republican when it comes to the budget - http://goo.gl/news/zEY3s  via http://news.google.com ,2017-03-02 22:06:45,0,0,837544758696259585
Donald Trump is president and I will buy as much useless plastic as I require to remain in a good mood,2017-03-02 21:33:24,2,1,837536362026840064
A High-End Consultant Who Brokers Deals in China Just Paid Donald Trump $16 Million https://www.google.com/amp/amp.slate.com/blogs/the_slatest/2017/02/28/trump_sells_luxury_penthouse_to_china_influence_peddler.html …,2017-03-02 21:29:30,0,0,837535384426860545
I will see Lester Holt punch Donald Trump in freezing temps.,2017-03-02 21:13:51,3,1,837531442053697537
Inside Donald Trump’s One-Stop Parties: Attendees Recall Cocaine and Very Young Models http://thebea.st/2dEr8j1  via @thedailybeast,2017-03-02 21:07:04,0,0,837529735471079426
I liked a @YouTube video http://youtu.be/gK3ZmAtVIPk?a  Donald Trump Dresses Up His Act: The Daily Show - Between the Scenes,2017-03-02 19:44:35,0,0,837508977701318656
@realDonaldTrump hahahaha I love this tweet so much it has hilarious cuz it is so true Donald Trump is  funny,2017-03-02 19:24:00,0,0,837503798385889280
AMAZING: President Donald Trump Speech at The USS Gerald R. Ford https://youtu.be/W9_upCMonOU  via @YouTube,2017-03-02 19:20:02,0,0,837502801634742274
Democrats’ Illegal Alien Scolds Donald Trump in Spanish For Denying Amnesty http://dlvr.it/NWtkN5 pic.twitter.com/fJl1RqFUL5,2017-03-02 18:49:06,0,0,837495015500754944
"Donald Trump Vows Renewed Expansion of Navy, Calls for Twelve Carrier Fleet http://dlvr.it/NWtGPd pic.twitter.com/2JyKoI7bhR",2017-03-02 18:15:48,0,0,837486637563027456
Sen. Perdue: Democrats Are ‘Focused on Sabotaging’ Donald Trump http://dlvr.it/NWtGLw pic.twitter.com/RgkDUewB5V,2017-03-02 18:15:42,0,0,837486610312679424
"The 5000 Fingers of Sean Hannity, by Donald Trump #TraumatizingKidBooks",2017-03-02 17:05:26,0,0,837468927919738881
The Clinton system to discredit Donald Trump http://stateofthenation2012.com/?p=67297 ,2017-03-02 17:04:06,0,0,837468593264586752
Here are 42 of President Donald Trump's planned EPA budget cuts http://s.oregonlive.com/gCrNv3R ,2017-03-02 17:03:29,0,0,837468438339584000
"Donald Trump Jr. was paid $50,000 for meeting to discuss U.S.-Russia cooperation in Syria http://www.dailykos.com/story/2017/3/2/1639449/-Donald-Trump-Jr-was-paid-50-000-for-meeting-to-discuss-U-S-Russia-cooperation-in-Syria …",2017-03-02 16:55:38,0,0,837466460100292608
".@SpeakerRyan, Insane Donald #Trump, why are you in such a hurry to fuck over 22 million people out of heath care?https://www.washingtonpost.com/powerpost/house-leaders-forge-ahead-with-health-bills-hoping-to-bulldoze-internal-strife/2017/03/02/17790e38-ff50-11e6-8ebe-6e0dbe4f2bca_story.html …",2017-03-02 16:36:54,0,0,837461748521193472
#CheckUrFacts1st  Bette Midlers Attempt To Fact-Check Donald Trump Backfires [Video] http://ln.is/com/m9E0r ,2017-03-02 16:36:12,0,0,837461572276596743
Jennifer Garner 'Looking Forward to Helping' Donald Trump http://bit.ly/2melM6k  via @BreitbartNews,2017-03-02 16:30:56,1,1,837460246238920705
@washingtonpost I heard he ate breakfast every day too JUST LIKE DONALD TRUMP,2017-03-02 16:19:33,26,2,837457382166814720
"Keep this shit up boys, and it will haunt you bigly - cut Insane Donald #Trump/.@potus/.@realDonaldTrump loose now
https://www.washingtonpost.com/powerpost/house-leaders-forge-ahead-with-health-bills-hoping-to-bulldoze-internal-strife/2017/03/02/17790e38-ff50-11e6-8ebe-6e0dbe4f2bca_story.html …",2017-03-02 16:07:42,0,0,837454398359887873
Coretta Scott King got it right the first time; Sen Warren was silenced for moving it forward Insane Donald #Trump http://www.alternet.org/sessions-doorstep-demonstrators-chant-lock-him …pic.twitter.com/LyzjdKuyYq,2017-03-02 16:04:03,0,0,837453479689932800
