Text,Date,Favorites,Retweets,Tweet ID
"Sheriff: Trucker claimed he had bombs, headed to Donald Trump
http://local21news.com/news/nation-world/sheriff-trucker-claimed-he-had-bombs-headed-to-donald-trump …",2017-03-05 07:45:02,0,1,838415060309438465
President Donald Trump is driven insane by his ego now he's claiming president Obama wired tapped him! Our president is insane!,2017-03-05 07:41:06,1,0,838414072823574530
"In today's @PatriotNews: Donald Trump's proposed EPA cuts could hurt water quality, Chesapeake Bay program http://www.pennlive.com/news/2017/03/trump_budget_cuts_could_set_ba.html …",2017-03-05 07:35:52,1,5,838412753756901376
Donald trump is on a rampage,2017-03-05 07:13:19,0,0,838407081241669632
I liked a @YouTube video http://youtu.be/OhkcU1Ls0fs?a  ‘DC insiders seek to defeat Donald Trump - even in aftermath of his victory’ –,2017-03-05 06:39:53,0,0,838398665219850241
America’s millions of Mexicans without documents live in fear of deportation: Donald Trump’s… http://m.tbnn.it/NXpy0y  | #Election2016,2017-03-04 23:51:07,0,0,838295796936159232
What would Mark Twain think of Donald Trump? http://ti.me/2lEDNq9 ,2017-03-04 22:32:12,0,0,838275935593984000
"I liked a @YouTube video http://youtu.be/7wbf8g5ilOo?a  ""Our conspiracy theory President is at it again"" Brian Stelter DESTROYS Donald Trump",2017-03-04 17:36:52,0,0,838201613449834496
Donald Trump's behavior is hurting the United States.,2017-03-04 16:31:01,1,0,838185041628958721
